,id,text,account_id,n,1,2,3,4,5
2616,123570494803951616,"Los Reyes Magos fueron los creadores de los preservativos... porque llegaron con oro, mirra y CON DONES... ",132679073,0,0,2,0,1,0
2617,398828698171756544,"Ignorar es la mejor forma de matar, sin mancharse las manos.",142482558,2,0,1,0,0,0
2618,453501575827173377,"Domingo: es ese día que duermo mucho, despierto cansado de dormir y vuelvo a dormir para descansar.",1518218509,2,0,0,2,0,0
2619,469900627535867905,"-¿Sabes cual es la diferencia entre la pizza y tu opinión?
-¿Cuál?
-Que la pizza si la pedí",124053720,1,0,1,0,1,0
2620,87193942805848064,Un tipo a una mujer: -Es increíble que la seda de su vestido venga de un gusano -No hable así de mi marido! ,132679073,1,0,0,0,0,2
2621,447783221200039937,—¿Te gusta la química? —Nitrato de entenderla.,1518218509,0,0,1,0,2,1
2622,454624785507418115,"Cosas que hago al ""estudiar"" : 1% estudiar. 29% mirar cuantas hojas de apuntes me quedan. 70% decirle a los demás que tengo que estudiar.",1518218509,2,1,1,1,1,1
2623,482219707542421505,Según mi mamá: ¿Dolor de cabeza? La computadora. ¿Dolor de espalda? La computadora. ¿Me atropellan? La computadora..,1518218509,0,1,1,0,1,0
2624,322556715176431616,"Mientras tú me ignoras, el helado que dejé afuera de la nevera se derrite por mí.",142482558,1,0,1,0,1,0
2625,469810034755371013,"— Papi, ¿Me das $50?..
— ¿¡QUE!? ¿Qué te de $40? ¿Para qué quieres $30 si con $20 es suficiente?... Ten $10 y dale $5 a tu hermano.",124053720,1,2,0,1,0,0
2626,315890876498972672,Agregar un JAJAJA para que la indirecta sea leve,118161896,3,0,0,0,0,0
2627,448691366042685440,Una de las ventajas de no ser feliz es que se puede desear la felicidad,229144847,2,0,0,1,0,0
2628,45991975006113792,El que sabe sabe... Y el que no sabe... es JEFE  ,132679073,1,0,1,1,0,0
2629,468878718115786753,"En clase: 1+1=2. Ejercicios para casa: 1+2+1=4. Examen: Maria compró 4 uvas, se comió una y le dio otra a Pedro, calcula la masa del Sol.",229144847,0,1,0,1,0,1
2630,488473001222873088,"No llores por alguien que no merece tus lágrimas.

A no ser que lo mates y tengas que llorar en su funeral para no levantar sospechas.",124053720,0,0,0,0,3,1
2631,474658240333377536,"Cosas que digo en clases: ""me quiero ir"", ""tengo hambre"" ""tengo sueño"", y preguntar a cada momento ¿Qué hora es?..",124053720,2,0,0,1,0,0
2632,103885812671856640,Le dice un borracho a una señora que está dando pecho! -Señora hip! Aunque no lo crea su hijo me invitó a cenar! ,132679073,0,3,0,0,1,0
2633,230866124206665729,"RT @CaritoAgudelo: NO QUIERO que se vaya Mateo!! Todo lo que dijo es real! Además es de los que mejor actúa, voten por Oscarrrrr!! ",574848706,5,0,0,0,1,0
2634,449813961928499200,"—¡Amor! Adivina que, no estoy embarazada.. —Enserio mi amor, que felicidad :') —No, idiota si lo estoy, feliz día de los inocentes. — :(",229144847,4,1,1,0,0,1
2635,411201473679482880,Entender un tema de matemática y sentirte Dios,118161896,3,1,1,2,0,0
2636,226851047933616128,Odio que la canción se equivoque cuando estoy cantando.,574848706,1,2,0,1,2,0
2637,476555555901693953,Milenio:1000 años. Siglo: 100 años. Década: 10 años. JUNTOS PARA SIEMPRE: De 1 a 2 meses.,297164177,1,1,0,0,0,1
2638,445638248304373761,"–Soy bidente. —¿Puedes ver el futuro? —No, sólo tengo dos dientes JAJAJAJAJÁ —¿Eres idiota? —No, soy un conejo JAJAJAJAJAJÁ. :B",229144847,1,2,1,0,2,1
2639,458984410293878785,"–¡Mira! ¡Un fin de semana! –¿Dónde? –Ya no, ya pasó.",1518218509,1,1,1,2,0,0
2640,443953659110363136,"Amistad sin bullying, no es amistad.",229144847,6,0,0,2,1,0
2641,302426358095699968,15 de Febrero. Día Mundial de la lucha contra el cáncer infantil. Mucho ánimo y fuerza para todos los que lo padecen.,142482558,3,0,0,0,0,0
2642,325786642453508096,RT @NewBirdVe: Después de un largo día nada mejor que un masaje de pies ¡uff! ¿si o no?,142482558,3,0,0,0,0,0
2643,227567517621682176,Una mujer encabronada debería considerarse como arma blanca.,574848706,1,1,1,1,0,2
2644,444623597777461248,"Ese momento incomodo cuando no escuchaste nada de lo que te hablaron y respondes: ""jaja si"".",229144847,6,2,1,0,1,0
2645,486008447457329152,Típico: Les das todo y te cambian por nada.,124053720,3,0,0,0,0,0
2646,324186547031261184,"Cada vez que dices ""no puedo"" pierdes la oportunidad de demostrarte a ti mismo de las cosas que eres capaz.",142482558,3,0,0,0,0,0
2647,450652091111837697,"Típico ; Amigos que no entienden el significado de ""Mira disimuladamente""",1518218509,7,0,0,2,0,0
2648,474792823435182080,"-Mi amor ¿Cómo me queda este vestido amarillo? 
-Winnie pooh ¿Qué estás haciendo aquí? (o.o)",124053720,0,0,0,0,2,1
2649,445669834211069952,A mi también me castigaron por reírme mientras mis papás le pegaban a mi hermano.,1518218509,11,3,0,0,2,0
2650,304891400292560897,"La expresión ""Dime la verdad"" viene del latín ""Ya lo sé todo pendejo!!!""",142482558,4,1,0,1,0,0
2651,75941138078507010,"-Esa chica tiene nalgas de burro... -¿De burro? -Sí, de burro de planchar! by @Rammoncho",132679073,1,1,0,1,0,0
2652,445869565184987136,"WhatsApp debería decir ""Tu mensaje ha sido enviado... visualizado, ignorado, humillado y olvidado con éxito.""",229144847,3,1,2,1,1,0
2653,304372506519801857,"RT dianadagostino_: ""El sabio no dice nunca todo lo que piensa, pero siempre piensa todo lo que dice"". -Aristóteles",142482558,5,0,0,1,1,0
2654,31537990832488448,"-Mi amor, no has visto mi libro COMO VIVIR 100 AÑOS. -Lo boté a la basura porque tu mamá lo estaba leyendo.  ",132679073,1,0,1,1,1,0
2655,306594065703661568,"Mi perro dice que las drogas son perjudiciales para la salud, pero yo no le hago caso.",118161896,2,0,0,0,1,0
2656,489479485725896704,El sexo es como las matemáticas. Súmale la Cama. Réstale la Ropa. Divide las Piernas Y ruega que no te multipliques!,174450359,2,1,0,0,1,0
2657,319862055505104896,No se si elegir esgrima o albañilería. Estoy entre la espada y la pared,118161896,0,1,1,1,0,0
2658,25631149153849346,"Un malandro le pregunta a otro: -¿Cómo se dice helmano en inglés? El otro contesta: -¡Coño, BROTHER, ni idea!  ",132679073,1,1,1,0,0,0
2659,447169766956863488,—¿Ayer lleva H? —No. —¿Y hoy? —Sí. —Como cambian las cosas de un día para otro. JAJAJAJAJAJAJÁ. —Tu retraso no.,1518218509,0,1,3,4,2,2
2660,469630330991685633,"Si una persona vuelve a tu vida para remediar el error que cometió, entonces vale la pena.",297164177,4,0,0,0,0,0
2661,43753688447193088,"Tengo una amiga que le dicen lechuga, porque en todas las fiestas la manosean pero nadie se la come! by @juankrloz17  ",132679073,1,0,0,1,1,0
2662,468345399191670786,"-Se terminó
- ¿QUÉ COSA? ¿LA COMIDA?
-No, lo nuestro
-Ahhh, no me asustes, pensé que no había más comida",124053720,1,0,1,1,1,0
2663,301726981937057792,"RT @laseptimabutaca: Trailer de ""Rápido y Furioso 6"" que se estrenará en mayo de este año 2013 http://t.co/tklxfuFx http://t.co/c5aS4hw2",142482558,3,1,0,0,0,0
2664,471969650809790464,"*Chocan y se caen los libros* Películas: Descuida, ¿Como te llamas? ¿Salimos? Realidad: ERES UN PENDEJO, QUITATE DE MI CAMINO.",297164177,2,1,0,0,0,0
2665,474105325529083905,Cuando nos vemos? Cuando quieras! -Mañana? No puedo. El lunes? -Tampoco puedo. El Jueves? No puedo. Cuando entonces? ¡Cuando quieras!,229144847,2,0,0,3,0,1
2666,211473266471206912, Aqui!   █   █ /█\ /█\ .||. .||. (Las partes de un cuerpo de un negro),574848706,1,2,0,0,0,0
2667,302253435720433665,RT @laseptimabutaca: La nueva película de Batman podría estrenarse antes que “Justice League” http://t.co/Sh7jCYLl,142482558,2,0,1,0,0,0
2668,293878386839932928,"- ¿Usted vino a estudiar o hablar? -Mire profesor, llegué a dormir en realidad, pero con todo este ruido es difícil",118161896,1,2,0,1,0,0
2669,47033577988308992,"Cuando un hombre pierde parcialmente el apetito, es que está enamorado; y cuando lo pierde completamente, está casado.",132679073,0,1,2,0,0,0
2670,318105891729731584,"-Háceme un favor - ¿Cuál? -Deja de sonreír - ¿Por qué? -Porque me estás enamorando –Ayyy ♥ ¿En serio? -JAJAJAJA mentira, tenés una lechuga.",118161896,0,2,0,1,0,0
2671,493947581437710336,RT @ParejaCursis: Por esa persona que cuando la ves se te olvida el mundo.,297164177,3,0,0,0,0,0
2672,160951284130775040,Los perros que ladran no muerden... mientras están ladrando. ,132679073,0,1,0,0,2,0
2673,362160061851774976,"Me pone muy nervioso que me cojan el móvil. No tengo nada que esconder, pero… ¡NO LO TOQUES COÑO!",142482558,1,0,1,1,0,0
2674,465551932493291520,"La vida es como el Tetris: tus aciertos desaparecen, mientras que tus errores se acumulan.",124053720,3,0,0,0,0,1
2675,303690866592186371,"-Señor, ¿Sabe dónde está el Palacio de Justicia? -El Palacio está a la vuelta de la esquina, ahora la justicia es más difícil de encontrar",118161896,1,0,2,0,0,0
2676,448422203957080064,Tipico: Estar toda la noche despierto y luego sufrir para levantarse temprano.,1518218509,4,0,0,0,0,1
2677,355368894564794369,Formo parte del porcentaje de la población que quiere hacer algo antes de que el microondas llegue a 0,118161896,2,0,1,0,0,0
2678,455841324693221376,"Con este 1% de batería que me queda, quiero decirte que me gus",142482558,0,1,0,2,0,0
2679,451273477152972800,Intentar hablar bostezando e inventar un nuevo idioma.,297164177,3,1,1,0,0,0
2680,465189534334873602,"Abuelas que antes de llamarte por tu nombre, te mencionan a todos tus primos.",124053720,2,1,0,0,1,2
2681,472453170451709953,"Me encantas, ¿lo entiendes o te lo explico a besos?",229144847,3,0,0,0,0,0
2682,215588703429599232," Jajaja, Ese man coje de objeto sexual a las mujeres y ustedes lo alaban jajaja, Que moral!!!",574848706,3,1,0,0,0,0
2683,451374540505890816,"Odio los lunes, los martes, los miércoles, los jueves y la mitad del viernes.",1518218509,5,1,0,1,1,1
2684,36910907623739392,"Anoche discutí con mi mujer, y le recordé que soy yo quien lleva los pantalones. Entonces me recordó que es ella quien me los quita...",132679073,0,0,0,0,3,1
2685,465650423366696962,"Pijama También conocido cómo: ""El uniforme de los domingos""",297164177,1,1,2,0,0,0
2686,464283795756052480,"Existen 5 niveles de temor:
—El miedo.
—El pánico.
—-El celular que se cae.
—12 llamadas perdidas de tu mamá.
—Y el ""tenemos que hablar"".",124053720,0,0,0,3,1,0
2687,230869059850366977,"Yo te espero, pero ten en cuenta que quizás el tiempo no lo hará.",574848706,4,0,0,0,0,0
2688,314563133131857922,NOMBRE: llaves. OCUPACIÓN: Abrir puertas. HOBBIES: Jugar al escondite.,118161896,1,2,0,2,1,1
2689,378647986990878720,Novia es novia las demás que ladren.,142482558,3,0,0,0,0,0
2690,293178493984985089,"Un loco le dice a otro: -Adivina que tengo en la mano –Un elefante -No vale, ya lo viste",118161896,0,1,3,1,0,2
2691,486342274771845120,Mi mente le hace bullying a mis sentimientos,118161896,3,0,0,0,0,0
2692,277998925665927168,"Dos amigos hablando: - Hola, repetiré todo lo que digas - ¿Ah sí? - ¿Ah sí? -Eso molesta -Eso molesta - Soy un idiota -Eso ya lo sabia",118161896,0,1,1,0,1,0
2693,310895965768912896,"-Papá me pican los mosquitos -APAGA LA LUZ *la apaga y entran dos luciérnagas* -Papá, papá, ya me están buscando con linternas :(",118161896,0,1,1,1,0,0
2694,246798026264440832,TÍPICO: Estas aburrido y NADIE te habla... Estas ocupado y te hablan TODOS,574848706,3,1,0,1,0,1
2695,365862687789420544,"En algo tan pequeño como una lágrima, cabe algo tan grande como un sentimiento.",142482558,3,0,0,0,0,0
2696,69776967599271936,"El marido a su mujer: -El Dr. me pide muestras de mi excremento, esperma y orina. -Fácil, dale tu calzoncillo. ",132679073,1,1,0,1,0,0
2697,341212154231390209,"RT @PuntoGYM: La confianza es como una goma de borrar, se vuelve más y más pequeña después de cada pequeño error.",142482558,3,0,0,0,0,0
2698,97704513930145792,"No es envidia, pero me gustaria tener tus ojos, tu cara, tu cuerpo, porque ¿sabes? no tengo disfraz para halloween ",132679073,0,0,1,2,0,0
2699,431979575845728256,"-Mi amor, ¿me queres de verdad? -Claro que te qui...GOOOOLLL",118161896,1,1,1,0,0,0
2700,448477903362064384,—¿De dónde vienes? —Del salón de belleza. —¿Y qué... No había luz?,229144847,1,1,1,0,0,2
2701,292340250028679169,"Ponerte a estudiar, mirar un momento el Twitter, actualizar Facebook y al final perder toda la tarde",118161896,2,1,0,1,0,0
2702,304983943130779648,"¡Papá papá, tengo un lío de faldas! -¡Ese es mi hijo, a ver cuéntame! -¡No se si ponerme la falda azul o la rosa!",142482558,0,1,0,0,0,2
2703,489424258347454466,"Mis abuelos conocieron la Radio y tuvieron 9 Hijos. Mis Padres la TV y somos 3 hijos. Yo conocí el ""Internet"" y aquí se acabo la Familia.",124053720,2,1,0,0,0,0
2704,447274815884259328,"Típico: Despertar con sueño, dormir con sueño, vivir con sueño.",1518218509,3,0,1,0,0,0
2705,331364429922963456,"Va un señor al confesionario y el cura estaba comiendo. Entonces, el señor le dice: - He pecado. Y el cura le responde: - No. E’ pollo.",142482558,0,1,1,1,0,0
2706,25319166894407681,¿De qué murió el Capitán Garfio? ¡De un picor de cojones!  ,132679073,2,0,0,0,1,0
2707,451963604099530752,Típico: Lanzar el móvil a la cama y sufrir porque no se caiga con tantos rebotes.,229144847,6,1,0,2,0,0
2708,319237858395299840,"Decir ""Perdón"" es complicado, pero lo realmente difícil es decir ""Aserejé ja deje, dejebere seibinouva majavi ande bugui ande güididípi""",142482558,1,1,0,1,0,0
2709,33944246998278144,¿Qué tienen las mujeres en medio de las piernas? ¡Las rodillas! ,174450359,0,1,1,0,1,0
2710,430404543588089856,"El 14 de febrero tendría que ser navidad, digo... por tanto animal con cuernos llevando regalos",118161896,1,0,0,2,1,0
2711,456418940105682946,Madurar es aceptar que la carta de Hogwarts nunca va a llegar.,297164177,2,0,1,0,2,0
2712,473154454552707073,"Extraño mi infancia, donde lo único que me dolia era cuando me raspaba las rodillas.",297164177,4,0,1,1,0,0
2713,455700937831501824,Mi memoria es: — 5% nombres — 3% números telefónicos — 2% asuntos del colegio — 90% letras de canciones.,229144847,2,1,0,0,0,0
2714,435124770481659904,- ¡Que auriculares tan grande tienes! - ¡Son para ignorarte mejor!,118161896,0,0,0,1,2,0
2715,2825871870140416,"¿Qué le dijo la vagina al pene? ¡Qué haces ahí parado, entra! ",174450359,0,0,1,1,1,0
2716,65177745327529985,"La negra: -Oye negro quiero DVD -Ay la negra enloqueció, vos no sabes sumar, pa' que querés dividi? by @franklintobon  ",132679073,1,1,0,1,1,0
2717,472764660131708928,En vacaciones cuando despierto no se si desayunar o almorzar.,229144847,3,0,0,0,0,0
2718,216742268764303362, Cualquier disco que no sea regayton ,574848706,3,0,0,0,0,0
2719,484776579915345920,"-Tengo hambre - ¿De qué? -De tus labios, para besarte como si no hubiese un mañana -Ayyy, ¿en serio? -No, pasame las galletitas",118161896,0,0,0,2,1,0
2720,227568786394472448,"No te deseo mal, pero... ¡Ojala y tu cajita feliz venga sin juguete!.",574848706,1,1,0,0,1,0
2721,455834956930252800,¿Soy el único que cuando escucha música con auriculares siente que todo el mundo te está llamando?,142482558,2,0,0,0,0,1
2722,383390414440779777,"RT @NewbirdVe: ¿Sabías que el calzado de los más pequeños debe ser revisado cada tres meses, para controlar que no les quede ajustados? …",142482558,3,0,0,0,0,0
2723,294200929878671362,- ¿Sos ganadero? -No - ¿Y qué haces con esa vaca? - ¡Papá! deja a mi novia en paz -JAJAJA que nos deje un litro de leche o se va - :(,118161896,1,0,2,1,0,0
2724,35843181526388736,"El maestro a Jaimito: -¿Te ayudó tu papá a hacer la tarea? -No maestra, la hizo toda él solito...  ",132679073,0,0,1,1,2,0
2725,453532588125069312,"— Mamá, mamá, ¿Qué es robar? — Cállate y sigue corriendo.",297164177,0,1,0,2,2,1
2726,293847105099935744,"-Hola, soy Diego –Discúlpame, no sabía que eras ciego -Dije que me llamo Diego, sorda -Ahh, ¿y todavía me decís gorda? ¡Mátate!",118161896,0,2,2,1,0,1
2727,73146532177780737,"-Mis vecinos están siempre fuera de casa, tomando el sol o jugando futbol. -Pobres, seguro no tienen Internet... ",132679073,2,0,0,0,0,1
2728,453986350635941888,"- ¿Tus padres son arquitectos? -No -Pero si sos todo un monumento -Ayyy ♥ -Jajaja mentira, es que necesito trabajo de albañil - :(",118161896,1,0,2,0,0,0
2729,300019993272266752,RT @dondealfredo: Cada vez más cerca del Día del alcohol y la amistad... ¿O cómo era? ,142482558,3,1,1,0,0,0
2730,273141199207034880,"-Mi vida, estás muy gorda -¡Ay mi amor! ¿No puedes decirme algo más dulce? -No, porque te lo comerías...",132679073,0,0,1,2,2,0
2731,493911055446188032,RT @SuperSarcastico: Una delicia el bosque: http://t.co/4mVTl1wRsG,1518218509,3,0,0,0,0,0
2732,37235349759602688,Mas vale siete veces con Blancanieves que una vez con cada enano.   ,132679073,0,0,1,2,0,0
2733,473902558181089280,- ¿Qué tenes mañana a primera hora de clases? -Ganas de asesinar a todos,118161896,1,0,2,0,0,0
2734,318663980455456769,"Detrás de una horrible cruda, hay una hermosa peda.",142482558,1,2,0,0,0,0
2735,478884775164276736,"TOC TOC!
-Quien es?
-Soy tu nuevo vecino, soy rubio y actor porno.
-Ay! Voy.
-Ajaa zorra! Somos los Testigos de Jehova ARREPIENTETE DEMONIA!",124053720,0,0,0,0,3,1
2736,46783660862603265,"-Dr., mi hijo tiene 6 meses y no abre los ojos. -El que debe abrir los ojos es Ud., este bebé es chino!  ",132679073,0,1,0,2,1,0
2737,463133143630106624,"Fulano y mengano, dos ejemplos de vida",118161896,1,1,0,0,1,0
2738,339745518731280384,"Me gusta que me vacunen y decirle a las enfermeras ""La bashe de datosh de virush, ha shido actualizada"". ",142482558,1,1,0,1,0,1
2739,481388748769198080,"–¿Me das? – ¡Nooooooooo! – ¡Ok, gracias! –¡Mentira toma! – ¡No, gracias ya no quiero!",1518218509,3,0,0,0,0,0
2740,472498541135294464,Mosquitos que practican Formula 1 en tu oreja.,297164177,3,0,0,0,2,0
2741,65863989732712448,¿Donde encuentras un perro sin piernas? Exactamente donde lo dejaste! by @israelrdz   ,132679073,1,0,1,0,0,1
2742,388120499814801408,"-Hijo! tienes la bragueta abierta, se te va a escapar el pajarito! -Tranquila, volverá, tiene los huevitos aquí.",132679073,1,0,1,0,1,0
2743,456546721418313729,"No tengo iPhone, iMac ni IPad porque no iPlata.",1518218509,1,1,1,1,1,0
2744,444543881296637952,Típico: Estás acostado de lo más lindo y tú mamá dice: Pásame un vaso Baña al perro Arma una bomba nuclear Limpia la casa.,229144847,8,1,1,0,0,0
2745,110159078831034368,Ya rebasamos los 400 mil seguidores! Gracias a todos por su apoyo!,132679073,3,0,0,0,0,0
2746,487309507442118656,"Maestra en clase de Anatomía: -¿Cuántos huesos tiene el hombre? Pepito rápidamente: -¡Dos! -Dije ""huesos"" Pepito",174450359,1,1,0,1,1,0
2747,389784205091016704,"""Pero tiene una cara bonita.""     — Una mujer intentando defender a su amiga gorda.",142482558,1,0,0,1,1,0
2748,354407806805344256,"- Hola, ¿cómo te llamas? - María de Los Ángeles, ¿y tú? - Daniel de Nueva York",142482558,0,0,1,0,2,0
2749,387395704873689088,¿Cuál es el colmo de un coleccionista? Cortarse un huevo para no tenerlo repetido.,132679073,0,2,0,0,2,0
2750,209340892417503232, Has subido unos kilitos mamita...,574848706,3,0,1,0,1,0
2751,446025582854160385,"—¿Cómo te llamas? —No sé, estoy de vacaciones.",229144847,2,2,0,0,1,0
2752,457002427518959617,"Los profesores lo llaman: ""copiar"". Yo lo llamo: "" trabajo en equipo"".",297164177,0,0,2,1,0,0
2753,456487800926240768,"Fracasaste como celular, si cuando te perdiste no estabas en silencio.",229144847,2,0,2,1,1,0
2754,317951028114907136,Lo único bueno de la III Guerra Mundial es que no tendré que estudiarla. ,142482558,0,0,1,2,0,2
2755,302780641928429569,"Anoche entraron a robar en casa y esta mañana nos hemos encontrado un billete de 50 € y una nota que pone: ""Espero que las cosas mejoren"".",142482558,0,0,2,0,0,2
2756,475675347774492673,"RT @CuriosoDato: Cuando una mujer dice: ""No te preocupes... ¡PREOCÚPATE!""",229144847,3,0,0,0,0,0
2757,457249169569091584,"Mi letra favorita, la C : Computadora. Celular. Cama.",1518218509,2,0,0,0,0,1
2758,463053419754700800,Si callas es malo. Si eres sincero es peor.,1518218509,3,0,0,1,0,1
2759,471832087113515008,"- ¿No te cansás de dormir? -Sí, por eso sigo durmiendo",118161896,0,1,0,2,0,0
2760,298451318501158913,RT @dondealfredo: ¿Llamas ''amigo'' a el que te ofrece alcohol?... Ése no es tu amigo... ¡Ése es tu hermano del alma! ¡No lo dejes ir!,142482558,2,0,0,1,0,0
2761,43393976245551104,"Tengo una amiga que le dicen ""La Tabla del Uno""...   porque es la más fácil de todas... by @ricarloss  ",132679073,1,1,1,0,1,1
2762,466518319877476353,"La delgada línea entre ""twittear"", ""mandar indirectas"" y ""desahogarse"".",124053720,4,1,0,0,0,0
2763,289170192699895808,": ""Red sin conexión""",118161896,1,0,1,0,2,1
2764,277115642530914304,- ¿Qué haces corriendo alrededor de la universidad? -Una carrera universitaria JAJAJAJA,118161896,0,1,0,0,1,1
2765,381574280179621888,"RT @CiseProgresa: Como todos los 21 de septiembre, hoy celebramos el Día Internacional de Paz. ¡Feliz sábado!",142482558,3,0,0,0,0,0
2766,340929222904250368,"—¿Me prestas tu baño? —Pero no hay papel.  —No importa, es para tomarme una foto para Instagram.",142482558,0,0,3,1,0,0
2767,462034877831860224,"Típico: Anotas cosas para no olvidaras, y olvidas donde las anotaste.",297164177,5,0,1,0,0,0
2768,326513882522861568,RT @CiseProgresa: ¿Qué esperas? Envía ya tu  a nuestro correo ciseredes@gmail.com y participa en nuestro concurso.,142482558,2,0,0,1,0,0
2769,473940372561747970,"Lo mejor del mundo: un abrazo con sabor a: estoy aquí, contigo, y nunca te dejare.",1518218509,2,1,0,0,0,0
2770,346656290795311105,"A las mujeres no hay que entenderlas, hay que comprarles ropa.",142482558,2,0,1,0,0,0
2771,324137828713906176,"—Mamá ¿me haces una pasta de harina precocida con inosinato disodico y gluten? —¿Una Maruchan? —JAJAJÁ sí, siempre se me olvida ese nombre.",142482558,1,2,1,0,0,0
2772,469339426129059840,Nunca digas 'no tengo nada que hacer' cerca de tu mamá.,1518218509,4,0,0,0,0,0
2773,469279540410589184,Me cae  mal esa gente que sale bien en todas las fotos,118161896,3,0,0,0,0,0
2774,277827026814111744,Estudiar acostada y quedarse dormida a los 10 minutos,118161896,6,0,0,0,0,0
2775,444560031405461504,"—Oye, ¿cómo te fue en la escuela este semestre? —Mira, mamá, lo importante, es que ya estoy de vacaciones",229144847,0,2,1,1,0,1
2776,306958520396427264,"Muchos podrán pisar el camino, pero pocos dejan huella.",142482558,2,0,1,0,0,0
2777,289951429098086400,"-Mamá, ¿Por qué te la pasas viendo programas de cocina en la TV si ni sabes cocinar? -Ay hijo, vos ves porno, sos virgen y yo no digo nada.",118161896,1,0,0,1,1,1
2778,226846349210042368,Chao Elianis Yo conosco Gays Pero Oscar ya es el colmo hombre...  Es una farsa... No sean ilusos colombianos,574848706,3,0,0,0,0,0
2779,484526698952945664,"RT @Mery_James46: Con un solo dia entero me conformaría T.T RT ""@A_reirse:  una batería que dure una semana""",118161896,3,0,0,0,0,0
2780,351794916306857984,- ¿Nivel de inglés? -Alto - ¿Qué significa never? -Nunca - ¿Y never ever? -Fácil: Nunca unca - ¡Contratado!,118161896,0,0,0,1,1,1
2781,285238907254210560,"-Hola, ¿queres venir conmigo al cine? -Si :D ¿a ver una película? -No, a contar cuantas sillas hay",118161896,2,0,1,0,1,0
2782,463589203540844544,Se te ocurren las mejores respuestas después que se acaba la pelea.,124053720,2,0,0,1,0,0
2783,447849379668312064,Amigo es ese que se te caga de risa en la cara cuando ve tu nuevo corte,1518218509,4,0,0,0,0,0
2784,454930722243878914,Hay 3 tipos de estudiantes: Los que estudian todos los días. Los que estudian un día antes. Y los que… ¿¡AHH NO MAMES QUE HABÍA EXAMEN!?,297164177,2,0,0,0,1,0
2785,218496793825120258,"¿Para qué dar una segunda oportunidad, si hay alguien mas esperando por la primera?",574848706,2,0,1,0,0,0
2786,446436131513860097,–¿Mamá? –¿Qué? –Te amo –¡YA TE DIJE QUE NO VAS A SALIR!,229144847,2,3,0,1,0,0
2787,44588205164597248,Va 1 marica dandose palmadas en las nalgas y 1 tipo dice: -DALE COMIDA -Ya comió estúpido! Le estoy sacando los gases by @Franco_DMA,174450359,0,1,2,0,0,0
2788,310566385434652674,"-Profe, ¿Cómo dijo? -No repito dos veces -Váyase a la mierda - ¿Cómo dijo? -No repito dos veces",118161896,1,1,0,0,1,0
2789,452266786356858880,"Para poder dormir bien no es necesario acostarse temprano, sino levantarse tarde.",229144847,4,0,1,1,0,0
2790,82139124215193600,"Había una mujer tan fea, que cuando la llevaron a la casa de los espantos, regresó con una solicitud de empleo. ",132679073,1,0,1,0,1,1
2791,299940330520866816,"-Estoy leyendo un libro que se llama ""La honestidad y otros valores"" -Que bueno, ¿dónde lo compraste? -Me lo robé de la biblioteca.",118161896,0,0,1,1,0,1
2792,384715399092109312,"El amor no se manifiesta en el deseo de acostarse con alguien, sino en el deseo de dormir junto a alguien.",142482558,2,0,0,0,0,1
2793,38370939255136256,"-Camarero ¿este pan es de ayer? -Sí. -¡Quiero pan que sea de hoy! -Bueno, venga mañana.  ",132679073,0,0,1,0,0,2
2794,447915990563581952,"Tipico: vas por la calle, encontras una piedra y la pateas todo el camino",1518218509,5,1,0,0,0,0
2795,16641454029930496,"No es lo mismo decir: te mandé a guardar mi yate, que ya-te lo mandé a guardar! ",174450359,0,2,0,1,1,0
2796,445772121873330176,Típico : de pequeño peleabas la tv con tus Hermanos y te llevaste el control hasta el baño para que no te cambiarán de canal.,229144847,7,1,0,2,0,1
2797,458618463615856640,"La cárcel debe ser un lugar grandioso. Todo el mundo, mata, roba y viola para estar en ella.",297164177,1,1,2,1,0,0
2798,282656296883339264,"Te desearía lo mejor, pero ya me tuviste",118161896,2,0,0,1,0,0
