,text,category
714,No hay peor decepción que te mientan cuando ya sabes la verdad. adverb verb adjective noun pronoun pronoun verb conjunction adverb verb determiner noun punctuation,0
715,"-¿Queres casarte conmigo? -¿Quién es Migo? -Jajaja no, vos y yo - ¿Los dos nos casaremos con Migo? - ¡Yo contigo! - ¿Quién es Tigo? - ¡NOOO! punctuation punctuation noun verb pronoun pronoun punctuation punctuation punctuation pronoun verb noun punctuation punctuation noun adverb punctuation pronoun conjunction pronoun punctuation punctuation determiner number pronoun verb adposition noun punctuation punctuation punctuation pronoun pronoun punctuation punctuation punctuation pronoun verb noun punctuation punctuation punctuation noun punctuation",1
716,Los borrachos son como los gatos siempre regresan a casa y nadie sabe como. determiner noun verb conjunction determiner noun adverb verb adposition noun conjunction pronoun verb conjunction punctuation,1
717,"2 palabras 9 letras 1 mentira universal ""Estoy bien."" number noun number noun number noun adjective punctuation verb adverb punctuation punctuation",0
718,"Las 4 etapas del ser humano: Yo creo en Santa, yo no creo en Santa, yo me siento Santa, yo parezco Santa!  determiner number noun adposition determiner noun adjective punctuation pronoun verb adposition noun punctuation pronoun adverb verb adposition noun punctuation pronoun pronoun verb noun punctuation pronoun verb noun punctuation",1
719,"“¡Lo haces bien rico mamita!” -Lalito, 10 años, su mamá le preparó su chocolate... ¿qué pensaron? punctuation punctuation determiner noun adverb adjective noun punctuation punctuation punctuation noun punctuation number noun punctuation determiner noun pronoun verb determiner noun punctuation punctuation pronoun verb punctuation",1
720,La gente tiene una cosa en común: todos ellos son diferentes.  determiner noun verb determiner noun adposition adjective punctuation pronoun pronoun verb adjective punctuation,0
721,"-Doctor ¿como salió la operación? -Señora, la operación fue un éxito, ojalá nos salga así la autopsia! by @Cristhian83  punctuation noun punctuation conjunction verb determiner noun punctuation punctuation noun punctuation determiner noun verb determiner noun punctuation interjection pronoun verb adverb determiner noun punctuation noun punctuation number",1
722, ''Sigamen los buenos!'' punctuation noun determiner adjective punctuation punctuation,0
723,Todo comenzó con una solicitud de amistad. pronoun verb adposition determiner noun adposition noun punctuation,0
724,Eres la persona correcta para hacer lo incorrecto. verb determiner noun adjective adposition verb determiner adjective punctuation,1
725,"Dios creo a todas las personas diferentes, pero llego a China y ya cansado dijo: Uff neeh mejor copiar y pegar. interjection verb adposition determiner determiner noun adjective punctuation conjunction verb adposition noun conjunction adverb verb verb punctuation noun interjection adjective verb conjunction verb punctuation",1
726,"-Papi, cómo se hacen los niños? -Mira Jaimito, papá pone una semillita en mamá -Ah, ya entendí, ¿y se la empuja con el pito? punctuation noun punctuation pronoun pronoun verb determiner noun punctuation punctuation noun punctuation noun verb determiner noun adposition noun punctuation interjection punctuation adverb verb punctuation punctuation conjunction pronoun pronoun verb adposition determiner noun punctuation",1
727,"El profe a Pepito:
 
— ¿Cómo suena la M con la A?
— MA
— Muy bien Pepito, ¿y con una tilde?
— MATILDE! determiner noun adposition noun punctuation punctuation punctuation pronoun verb determiner noun adposition determiner noun punctuation punctuation noun punctuation noun conjunction noun punctuation punctuation conjunction adposition determiner noun punctuation punctuation noun punctuation",1
728,"Si tu ex te dice: ¡Nunca encontrarás a alguien como yo! Contéstale: ¡ESA ES LA IDEA, COÑO DE TU MADRE!  conjunction determiner adjective pronoun verb punctuation punctuation adverb verb adposition pronoun conjunction pronoun punctuation verb pronoun punctuation punctuation noun punctuation noun punctuation",1
729,Gracias al celular por estar en esos momentos que no quieres saludar a esas personas que no te caen bien. adposition determiner adjective adposition verb adposition determiner noun pronoun adverb verb verb adposition determiner noun pronoun adverb pronoun verb adverb punctuation,0
730,Típico : siempre te fijas en quien no se fija en ti. noun punctuation adverb pronoun adjective adposition pronoun adverb pronoun verb adposition pronoun punctuation,0
731,"Decir ""ya fue"" y saber perfectamente que no fue un carajo. verb punctuation adverb verb punctuation conjunction verb adverb conjunction adverb verb determiner noun punctuation",0
732,Típico: Sentir presencias paranormales en tu casa únicamente cuando estás solo. noun punctuation verb noun adjective adposition determiner noun adverb conjunction verb adjective punctuation,0
733,Besos en el cuello = Adiós autocontrol. noun adposition determiner noun punctuation noun noun punctuation,0
734,Típico: Morder a las personas para demostrarles cariño. noun punctuation verb adposition determiner noun adposition verb pronoun noun punctuation,0
735,Un  para nosotras las mujeres que tenemos el don de enamorarnos del más imbécil. determiner adposition pronoun determiner noun pronoun verb determiner noun adposition verb pronoun adposition determiner adverb adjective punctuation,0
736,RT @CausandoRisas: Todos somos valientes hasta que la cucaracha vuela. noun punctuation noun punctuation pronoun verb adjective adposition conjunction determiner noun verb punctuation,0
737,—6 cosas que odia mi mamá: 1.Que salga. 2.Que no salga. 3.Que coma mucho. 4.Que coma poco. 5.Que duerma mucho. 6.Que duerma poco. punctuation number noun pronoun verb determiner noun punctuation number noun punctuation number adverb verb punctuation number noun adverb punctuation number noun adverb punctuation number verb adverb punctuation number verb adverb punctuation,1
738,"Los 5 consejos para tener el mejor sexo son: pulgar, índice, corazón, anular y meñique... by @alexazo  determiner number noun adposition verb determiner adjective noun verb punctuation adjective punctuation noun punctuation noun punctuation adjective conjunction adjective punctuation noun punctuation noun",1
739,"No son nuestras debilidades lo que nos muestra lo que somos, sino nuestras decisiones. BUEN DIA adverb verb determiner noun determiner pronoun pronoun verb determiner pronoun verb punctuation conjunction determiner noun punctuation noun",0
740,Mejor amiga + Yo = Locura total. adverb verb noun punctuation noun adjective punctuation,0
741,Entrar a la ducha y salir con un plan detallado de como solucionar todos tus problemas. verb adposition determiner noun conjunction verb adposition determiner noun verb adposition conjunction verb determiner determiner noun punctuation,0
742,Yo no estoy fumando policía señor marihuana :/ pronoun adverb verb verb noun noun noun punctuation punctuation,0
743,"-Jefe, usted es como una nube -¿Una nube? ¿Por qué? -Porque cuando se va tenemos un maravilloso día!   punctuation noun punctuation pronoun verb conjunction determiner noun punctuation punctuation determiner noun punctuation punctuation adposition pronoun punctuation punctuation conjunction conjunction pronoun verb verb determiner adjective noun punctuation",0
744,Típico: Tener una silla en tu cuarto con la única función de acumular ropa. noun punctuation verb determiner noun adposition determiner noun adposition determiner adjective noun adposition verb noun punctuation,0
745,"-Profe, no entiendo - ¿Qué no entendés? -Desde que empezaron las clases hasta hoy, creo que nada punctuation noun punctuation adverb verb punctuation punctuation pronoun adverb adjective punctuation punctuation adposition pronoun verb determiner noun adposition adverb punctuation verb conjunction pronoun",1
746,"— Miley Cyrus, ¿qué opinas de la economía mundial? — :P — ¿Y de las guerras? — :P — ¿De la pobreza en África? — :P — ¿ 2 x 2 ? — :P punctuation noun punctuation punctuation pronoun verb adposition determiner noun adjective punctuation punctuation punctuation noun punctuation punctuation conjunction adposition determiner noun punctuation punctuation punctuation noun punctuation punctuation adposition determiner noun adposition noun punctuation punctuation punctuation noun punctuation punctuation number noun number punctuation punctuation punctuation noun",0
747,RT @KlipXtreme: Odiar las alturas pero montarte en todas las montañas rusas con tus amigos porque la vida solo es una  noun punctuation noun punctuation verb determiner noun conjunction verb pronoun adposition determiner determiner noun adjective adposition determiner noun conjunction determiner noun adjective verb determiner,0
748,"-General, aquí hay un gay -¿Y cómo lo sabe, cabo? -Porque se robó mi esmalte de uñas, mi brillo labial y mi sombra!  punctuation adjective punctuation adverb verb determiner noun punctuation punctuation conjunction pronoun pronoun verb punctuation noun punctuation punctuation conjunction pronoun verb determiner noun adposition noun punctuation determiner noun adjective conjunction determiner noun punctuation",1
749,"Sonríe, nadie necesita saber que no estás bien. verb punctuation pronoun verb verb conjunction adverb verb adverb punctuation",0
750,Típico: Tener todo el tiempo del mundo y terminar haciendo todo a última hora noun punctuation verb determiner determiner noun adposition determiner noun conjunction verb verb pronoun adposition adjective noun,0
751,RT @dondealfredo: En 1506 el whisky únicamente podía ser vendido a cirujanos por sus propiedades medicinales.  noun punctuation noun punctuation adposition number determiner noun adverb verb verb verb adposition noun adposition determiner noun adjective punctuation,0
752,"RT @DichoDeLaAbuela: Quien calla, otorga. noun punctuation noun punctuation pronoun verb punctuation verb punctuation",0
753,¿Qué le dijo el papel higiénico a Batman? Soy el único que conoce tu Baticueva! punctuation pronoun pronoun verb determiner noun adjective adposition noun punctuation verb determiner adjective pronoun verb determiner noun punctuation,1
754,"Los amigos de verdad son aquellos que te ven llorando y te preguntan: ""¿A quién hay que matar?"" determiner noun adposition noun verb pronoun pronoun pronoun verb verb conjunction pronoun verb punctuation punctuation punctuation adposition pronoun verb conjunction verb punctuation punctuation",0
755,Típico: mirar el reloj tres veces y no saber que hora es noun punctuation verb determiner noun number noun conjunction adverb verb conjunction noun verb,0
756,"-Doctor, cuando me levanto estoy mareado, pero media hora después ya estoy bien -Pues levántese media hora más tarde!  punctuation noun punctuation conjunction pronoun verb verb verb punctuation conjunction adjective noun adverb adverb verb adverb punctuation conjunction verb pronoun adjective noun adverb adverb punctuation",1
757,Me suelta el sueño y me agarra la flojera. pronoun verb determiner noun conjunction pronoun verb determiner noun punctuation,0
758,"""Lo mejor de dormir contigo, es que eres lo primero que veo por la mañana"" —Yo, hablándole a mi celular. punctuation determiner adjective adposition verb pronoun punctuation verb conjunction verb determiner adjective pronoun verb adposition determiner noun punctuation punctuation noun punctuation verb pronoun adposition determiner adjective punctuation",1
759,"Sr. Lopez, la mancha en su pene no era gangrena, sino lápiz labial. Lamentamos la amputación...  noun punctuation determiner noun adposition determiner noun adverb verb noun punctuation conjunction noun adjective punctuation verb determiner noun punctuation",1
760,"Que alegria me da, Antes los TT eran  o cosas por el estilo, ahora es  o algo por el estilo! Que viva colombia! conjunction adjective pronoun verb punctuation noun verb conjunction noun adposition determiner noun punctuation adverb verb conjunction pronoun adposition determiner noun punctuation conjunction verb verb punctuation",0
761,"Osea, Traen a el papa de Oscar y no a la de Mateo? Señorita laura: Que entre el desgraciado de RCN!!! noun punctuation noun adposition determiner noun adposition noun conjunction adverb adposition determiner adposition noun punctuation noun noun punctuation conjunction adposition determiner noun adposition noun punctuation punctuation punctuation",0
762,-¡Policía! Dos chicas se están peleando por mí -¿Y cuál es el problema? -Es que va ganando la gorda! punctuation punctuation noun punctuation number noun pronoun verb verb adposition pronoun punctuation punctuation conjunction pronoun verb determiner noun punctuation punctuation verb conjunction verb verb determiner noun punctuation,1
763,"Era un cocinero tan feo, pero tan feo, que hacía llorar a las cebollas...    verb determiner noun adverb adjective punctuation conjunction adverb adjective punctuation pronoun verb verb adposition determiner noun punctuation",1
764,        ,0
765,"No es tuitear, es sacar todo lo que traes dentro. adverb verb verb punctuation verb verb determiner determiner pronoun verb adverb punctuation",0
766,"—Bienvenida a McDonalds, ¿qué le doy? 
—¡Vergüenza! 
—¡Ya mamá, estoy trabajando! 
—Uy, perdóneme ""señor licenciado en diseño gráfico"". punctuation noun adposition noun punctuation punctuation pronoun pronoun verb punctuation punctuation punctuation noun punctuation punctuation punctuation adverb noun punctuation verb verb punctuation punctuation noun punctuation verb pronoun punctuation noun verb adposition noun adjective punctuation punctuation",1
767,Hay besos que duran poco pero se sienten toda la vida. verb noun pronoun verb adverb conjunction pronoun verb determiner determiner noun punctuation,0
768,"Tipico : Te inspiras escribiendo un buen mensaje a alguien, y te responden “OK“. noun punctuation pronoun verb verb determiner adjective noun adposition pronoun punctuation conjunction pronoun verb punctuation adjective punctuation punctuation",0
769,Yo parezco normal hasta que entro en confianza. pronoun verb adjective adposition pronoun verb adposition noun punctuation,0
770,"Usar ""OK"" para abreviar infinitas manifestaciones de enfado y celos. verb punctuation adjective punctuation adposition verb adjective noun adposition noun conjunction noun punctuation",0
771," Barny es un dinosaurio alcohólico y demente, Fuma marihuana y Viola niños inocentes. noun verb determiner noun adjective conjunction adjective punctuation noun noun conjunction noun noun adjective punctuation",1
772,"Típico : Estar en Paint ,querer pintar con el balde una parte de tu dibujo y que te rellene todo y te arruine la obra de arte. noun punctuation verb adposition noun punctuation verb verb adposition determiner noun determiner noun adposition determiner noun conjunction conjunction pronoun verb pronoun conjunction pronoun verb determiner noun adposition noun punctuation",0
773,"—¿Cuánto es 2+1? —Yo que sé, estoy de vacaciones :) punctuation punctuation pronoun verb punctuation punctuation noun pronoun verb punctuation verb adposition noun punctuation punctuation",0
774,"Extraño el: ""Hagan un dibujo de lo que hicieron en vacaciones."" :( verb determiner punctuation punctuation verb determiner noun adposition determiner pronoun verb adposition noun punctuation punctuation punctuation punctuation",0
775,"@PitufoFilosofon A veces, el grito más fuerte de una mujer es el silencio. punctuation noun noun punctuation determiner noun adverb adjective adposition determiner noun verb determiner noun punctuation",0
776,"-¿Me das 40 condones? -...34, 35. Lo siento señor, sólo quedan 35 -Ya me arruinaste la noche! pero dámelos igual. punctuation punctuation pronoun verb number noun punctuation number punctuation number punctuation pronoun verb noun punctuation adverb verb number punctuation adverb pronoun verb determiner noun punctuation conjunction verb pronoun pronoun adverb punctuation",1
777,"Ese momento en que tenes tantas cosas por hacer y tantos deberes, que te colapsas y no haces nada. determiner noun adposition pronoun noun determiner noun adposition verb conjunction determiner noun punctuation pronoun pronoun verb conjunction adverb verb pronoun punctuation",0
778,Recientes estudios de la universidad de Colorado demuestran que los jóvenes de entre 17 y 19 años tienen 18. adjective noun adposition determiner noun adposition noun verb conjunction determiner noun adposition adposition number conjunction number noun verb number punctuation,0
779,RT @MichelPesquera: La persona que tiene confianza en sí misma gana la confianza de los demás. noun punctuation noun punctuation determiner noun pronoun verb noun adposition pronoun adjective verb determiner noun adposition determiner pronoun punctuation,0
780,Ambulancias del GTA que para salvar a una persona atropellan a 180. noun conjunction adposition verb adposition determiner noun verb adposition number punctuation,1
781,"Ser mujer es una tarea terriblemente difícil, ya que consiste principalmente de tratar con los hombres. -Joseph Conrad  verb noun verb determiner noun adverb adjective punctuation conjunction verb adverb adposition verb adposition determiner noun punctuation punctuation noun",0
782,Típico: todos tenemos un amigo que come como cerdo y no engorda. noun punctuation pronoun verb determiner noun pronoun verb conjunction noun conjunction adverb verb punctuation,0
783,Me cae mal la gente a la que le cae bien la gente que a mi me cae mal. pronoun verb adverb determiner noun adposition determiner pronoun pronoun verb adverb determiner noun pronoun adposition determiner pronoun verb adverb punctuation,0
784,"Una vez Superman necesitaba comprarse Superfume y pues nada, fue al supermercado. determiner noun noun verb verb pronoun noun conjunction conjunction pronoun punctuation verb adposition determiner noun punctuation",1
785,"RT @MichelPesquera: Pensé que entre más pasaran los días más facil sería aceptar la muerte de Sylvie, y entre más pasan los días, más me du… noun punctuation noun punctuation verb conjunction adposition adverb verb determiner noun adverb adjective verb verb determiner noun adposition noun punctuation conjunction adposition adverb verb determiner noun punctuation adverb pronoun noun punctuation",0
786,"Corre el rumor de que para mañana, habrá un ""Aló Presidente"" con ""mensajes escritos"" de . ¿Quién será la médium? verb determiner noun adposition conjunction adposition adverb punctuation verb determiner punctuation interjection noun punctuation adposition punctuation noun verb punctuation adposition punctuation punctuation pronoun verb determiner noun punctuation",0
787, Famosos estarian vendiendo AVON empezando por Linda palma noun verb verb noun verb adposition noun verb,1
788,"¿Esperar por ti JA JA JA JA JA JA JA JA JA JA JA JA JA JA JA JA JA JA JA JA JA JA JA JA JA JA JA JA JA JÁ ok, pero no tardes. punctuation verb adposition pronoun noun adjective punctuation conjunction adverb noun punctuation",0
789,-Hola bombón -Hola mojojojo punctuation interjection noun punctuation interjection noun,1
790, : Esperar a que ellos nos hablen primero. punctuation verb adposition conjunction pronoun pronoun verb adverb punctuation,0
791,"-Mi mujer me ha dejado. -Lo siento, debe ser duro que te deje tu mujer, verdad? -¿Duro? Fue casi imposible! punctuation determiner noun pronoun verb verb punctuation punctuation pronoun verb punctuation verb verb adjective conjunction pronoun verb determiner noun punctuation noun punctuation punctuation punctuation adjective punctuation verb adverb adjective punctuation",1
792,Tantos años y aún no sabemos que cara poner cuando nos cantan Feliz Cumpleaños. determiner noun conjunction adverb adverb verb conjunction noun verb conjunction pronoun verb noun punctuation,0
793,"—Amiga ésta semana bajé dos kilos.

—Woow ¿hiciste dieta?

—No, me desmaquillé. punctuation noun pronoun noun verb number noun punctuation punctuation noun punctuation verb noun punctuation punctuation noun punctuation pronoun verb punctuation",1
794,"LEY DE VIDA: Sí no le das importancia, mas te busca. noun punctuation adverb adverb pronoun verb noun punctuation conjunction pronoun verb punctuation",0
795,"Creo que mi habitación es un lugar santo, cada vez que mi mamá entra dice: ¡Díos mío! verb conjunction determiner noun verb determiner noun adjective punctuation determiner noun pronoun determiner noun verb verb punctuation punctuation noun verb punctuation",1
796,Ese momento incómodo en el que no sabes si lo soñaste o pasó de verdad. determiner noun adjective adposition determiner pronoun adverb verb conjunction pronoun verb conjunction verb adposition noun punctuation,0
797,"Lo importante no es que dure mucho, sino que valga la pena. determiner adjective adverb verb conjunction verb adverb punctuation conjunction verb determiner noun punctuation",0
798,Típico: saludar a un perro en la calle y que te siga todo el camino noun punctuation verb adposition determiner noun adposition determiner noun conjunction conjunction pronoun verb determiner determiner noun,0
799,- ¡Viva la buena ortografía! - ¡BIBA! punctuation punctuation verb determiner adjective noun punctuation punctuation punctuation noun punctuation,1
800,"""Tengo hambre"" — Yo a cada rato. punctuation verb noun punctuation punctuation noun adverb punctuation",1
801,"@iSinSuerteBrian Pobre. Encerio tus tweets me hacen mear de la risa, y solo e leido 5 de ellos punctuation verb noun punctuation noun determiner noun pronoun verb verb adposition determiner noun punctuation conjunction adjective conjunction noun number adposition pronoun",0
802,"— ¡CUIDADO CON EL BESOOOO!
— ¿Cuál be... punctuation punctuation noun punctuation punctuation punctuation determiner noun punctuation",1
803,"—¿Estás llorando? —No imbécil, me estoy riendo al revés. punctuation punctuation verb verb punctuation punctuation noun adjective punctuation pronoun verb verb adposition determiner noun punctuation",0
804,"No son celos, son mariposas encabronadas. adverb verb noun punctuation verb noun verb punctuation",0
805,RT @DeboRecordarQue: El amor a la libertad se halla arraigado por naturaleza en el pecho de todos los hombres. noun punctuation noun punctuation determiner noun adposition determiner noun pronoun verb verb adposition noun adposition determiner noun adposition determiner determiner noun punctuation,0
806,Madurar es de frutas... yo soy un bizcocho verb verb adposition noun punctuation pronoun verb determiner noun,0
807,"RT @SonBebidas: Los misteriosos vinos suizos:
estos vinos poseen una gran calidad y ofrecen maravillosas notas al paladar. noun punctuation noun punctuation determiner adjective noun adjective punctuation determiner noun verb determiner adjective noun conjunction verb adjective noun adposition determiner noun punctuation",0
808,Despertar temprano y odiar a todo ser humano que te hable. verb adverb conjunction verb adposition determiner noun adjective pronoun pronoun verb punctuation,0
809,Típico: Tus amigos siempre te hacen quedar mal con la persona que te gusta. noun punctuation determiner noun adverb pronoun verb verb adverb adposition determiner noun pronoun pronoun verb punctuation,1
810,¿En qué se parecen las mujeres a las matemáticas? En que no cualquier idiota las entiende.  punctuation adposition pronoun pronoun verb determiner noun adposition determiner noun punctuation adposition conjunction adverb determiner noun pronoun verb punctuation,0
811,"-Papá, ¿cómo nací yo? -Pues verás hijo, la historia comienza, con una farmacia cerrada... punctuation noun punctuation punctuation pronoun verb pronoun punctuation punctuation conjunction verb noun punctuation determiner noun verb punctuation adposition determiner noun verb punctuation",1
812,Estudiar en voz alta para crear una falsa sensación de aprendizaje verb adposition noun adjective adposition verb determiner adjective noun adposition noun,0
813,"El Papa lo tiene pero no lo usa, Bush lo tiene corto y Schwartzenegger lo tiene muy largo, ¿que es? !El apellido!  determiner noun pronoun verb conjunction adverb pronoun verb punctuation noun pronoun verb adjective conjunction noun pronoun verb adverb adjective punctuation punctuation pronoun verb punctuation punctuation determiner noun punctuation",1
814,¿En qué se parecen las nalgas a las cantinas? En que de las dos salen pedos. punctuation adposition pronoun pronoun verb determiner noun adposition determiner noun punctuation adposition conjunction adposition determiner number verb noun punctuation,1
815,"-Amor, ¿me veo gorda con este vestido? -No, para nada... A ver, roda para acá... punctuation noun punctuation punctuation pronoun verb adjective adposition determiner noun punctuation punctuation adverb punctuation adposition pronoun punctuation adposition verb punctuation noun adposition adverb punctuation",1
816,Creo que quiero más a la siesta que a muchos de mis parientes. verb conjunction verb adverb adposition determiner noun pronoun adposition pronoun adposition determiner noun punctuation,1
817,"RT @dondealfredo:  — ¡Hijo, hueles a vodka! — ¡En lo Absolut! noun punctuation noun punctuation punctuation punctuation noun punctuation verb adposition noun punctuation punctuation punctuation adposition determiner noun punctuation",1
