,text,category
1373,"A una mujer hay que conquistarla todos los días, aunque ya esté a tu lado. adposition determiner noun verb conjunction verb pronoun determiner determiner noun punctuation conjunction adverb verb adposition determiner noun punctuation",0
1374,"RT @SonBebidas: Los vinos tintos hacen un buen maridaje con carnes rojas y los blancos con carnes blancas, por ejemplo. noun punctuation noun punctuation determiner noun adjective verb determiner adjective noun adposition noun adjective conjunction determiner noun adposition noun adjective punctuation adverb punctuation",0
1375,"Le pusieron Twitter porque ""cada loco con su tema"" era muy largo. pronoun verb noun conjunction punctuation determiner noun adposition determiner noun punctuation verb adverb adjective punctuation",0
1376,Dejarlo todo y escaparme contigo. ¿Y tú? verb pronoun pronoun conjunction verb pronoun pronoun punctuation punctuation conjunction pronoun punctuation,0
1377,Hay 3 tipos de indirectas:  Las que parecen que son para ti.  Las que tú crees que son para ti.  Las que tú estás seguro de que son para ti. verb number noun adposition noun punctuation determiner pronoun verb conjunction verb adposition pronoun punctuation determiner pronoun pronoun verb conjunction verb adposition pronoun punctuation determiner pronoun pronoun verb adverb adposition conjunction verb adposition pronoun punctuation,0
1378,Un amigo de verdad es ese que te empuja hacia la persona que te gusta. determiner noun adposition noun verb determiner pronoun pronoun verb adposition determiner noun pronoun pronoun verb punctuation,0
1379,No sé si es el karma o es esa cadena de Hotmail que no envié en el 2007. adverb verb conjunction verb determiner noun conjunction verb determiner noun adposition noun conjunction adverb verb adposition determiner number punctuation,1
1380,Todas las mujeres necesitan un novio que a la misma vez sea su mejor amigo. determiner determiner noun verb determiner noun pronoun adposition determiner adjective noun verb determiner adjective noun punctuation,0
1381,"—¿Y tú qué querías papá, niño o niña?  —Yo sólo quería sexo.  —Ay :( punctuation punctuation conjunction pronoun pronoun verb noun punctuation noun conjunction noun punctuation punctuation noun adverb verb noun punctuation punctuation noun punctuation punctuation",1
1382,"Típico : Guardar archivo: ""ldksjdkjd"". El archivo ""ldksjdkjd"" ya existe. noun punctuation verb noun punctuation punctuation noun punctuation punctuation determiner noun punctuation noun punctuation adverb verb punctuation",0
1383,"Oye, ¿ya estoy bien maquillada? No, todavía se te ve la cara. punctuation noun punctuation punctuation adverb verb adverb verb punctuation punctuation noun punctuation adverb pronoun pronoun verb determiner noun punctuation",1
1384,"RT @SuperSarcastico: —¿Tan linda y sin novio? —JAJAJAJAJA, tonto, tu eres mi novio. —JAJAJAJAJAJAJA, te estoy cortando. —Ay :( noun punctuation noun punctuation punctuation punctuation adverb adjective conjunction adposition noun punctuation punctuation noun punctuation noun punctuation determiner verb determiner noun punctuation punctuation noun punctuation pronoun verb verb punctuation punctuation noun punctuation punctuation",1
1385,Típico: Poner un punto final en el chat para darle un tono de agresividad a la conversación. noun punctuation verb determiner noun adjective adposition determiner noun adposition verb pronoun determiner noun adposition noun adposition determiner noun punctuation,0
1386,", salir a despejar tu mente y lo primero que ves, un montón de parejas agarradas de la mano...y tu sol@!  punctuation verb adposition verb determiner noun conjunction determiner adjective conjunction noun punctuation determiner noun adposition noun verb adposition determiner noun punctuation conjunction determiner noun punctuation punctuation",0
1387,"—Buenos días, ¿Está maría ? —No, está equivocado —Ok, pásamelo  —Hola... ¿Equivocado? —Sí —¿Y María? punctuation noun noun punctuation punctuation verb noun punctuation punctuation noun punctuation verb verb punctuation noun punctuation verb pronoun pronoun punctuation noun punctuation punctuation verb punctuation punctuation noun punctuation punctuation conjunction noun punctuation",1
1388,Mi nivel de madurez depende de quién esté conmigo. determiner noun adposition noun verb adposition pronoun verb pronoun punctuation,0
1389,"-Mamá, ¿podes escribir en la oscuridad? -Creo que si, ¿por qué? -Porque necesito que firmes mis calificaciones punctuation noun punctuation punctuation verb verb adposition determiner noun punctuation punctuation verb conjunction conjunction punctuation punctuation adposition pronoun punctuation punctuation conjunction verb conjunction verb determiner noun",1
1390,Todo se vuelve más gracioso cuando estás en un sitio en el que no te puedes reír. pronoun pronoun verb adverb adjective conjunction verb adposition determiner noun adposition determiner pronoun adverb pronoun verb verb punctuation,0
1391,Si de niño no hiciste una casa con sábanas... No tuviste infancia! conjunction adposition noun adverb verb determiner noun adposition noun punctuation adverb verb noun punctuation,0
1392,"-Señora, perdimos a su hijo en la operación -Nooo, ¡no puede ser! -JAJAJA no sea llorona, ya lo encontramos, estaba en el baño punctuation noun punctuation verb adposition determiner noun adposition determiner noun punctuation noun punctuation punctuation adverb verb verb punctuation punctuation noun adverb verb adjective punctuation adverb pronoun verb punctuation verb adposition determiner noun",1
1393,-Hagan grupos de 3 - ¿No podemos ser 8 profe? punctuation verb noun adposition number punctuation punctuation adverb verb verb number noun punctuation,0
1394,"- ¿Lo rompiste? - No, se le salió el cosito... :s punctuation punctuation pronoun verb punctuation punctuation adverb punctuation pronoun pronoun verb determiner adjective punctuation punctuation noun",0
1395,"- ¿Por qué lloras? 
-Me acaban de mandar a la mierda 
- ¿Y no sabes llegar o qué? punctuation punctuation adposition pronoun verb punctuation punctuation pronoun verb adposition verb adposition determiner noun punctuation punctuation conjunction adverb verb verb conjunction pronoun punctuation",1
1396,Ojala y la batería de mi celular durara mas de una semana verb conjunction determiner noun adposition determiner adjective verb conjunction adposition determiner noun,0
1397,"-Hijo, por qué vienes ebrio? -Mamá, pero tu me dijiste EMBRIAGATE! -te dije ABRIGATE, IMBECIL! y @TnaaCH   punctuation noun punctuation adposition pronoun verb noun punctuation punctuation noun punctuation conjunction determiner pronoun verb noun punctuation punctuation pronoun verb noun punctuation noun punctuation conjunction punctuation noun",1
1398,Hoy es viernes de princesas y las princesas hacemos feliz a nuestro hombre sin importar qué tanto nos duela el cuello. adverb verb date adposition noun conjunction determiner noun verb adjective adposition determiner noun adposition verb pronoun adverb pronoun verb determiner noun punctuation,1
1399,- ¿Qué significa Nobody know it? -Nadie lo sabe - ¡No jodas! Entonces es un gran misterio por resolver -Imbécil punctuation punctuation pronoun verb noun noun noun punctuation punctuation pronoun pronoun verb punctuation punctuation adverb verb punctuation adverb verb determiner adjective noun adposition verb punctuation noun,1
1400,"No tengo ni iPod, ni iPhone, ni iPad, PERO ESO SI... EN MI CASA iPan. adverb verb conjunction noun punctuation conjunction verb punctuation conjunction noun punctuation noun punctuation noun noun punctuation",1
1401,"RT @NewBirdVe: RT Si a ti también te provoca que te den un buen masaje en los pies para empezar ""con buen pie"" la semana :) noun punctuation noun punctuation noun adposition pronoun adverb pronoun verb conjunction pronoun verb determiner adjective noun adposition determiner noun adposition verb punctuation adposition adjective noun punctuation determiner noun punctuation punctuation",0
1402,¿Por qué los de Lepe se quedan callados al contestar su celular? Porque el que habla paga   punctuation adposition pronoun determiner adposition noun pronoun verb verb adposition determiner verb determiner adjective punctuation conjunction determiner pronoun verb verb,1
1403, ¿Por qué es imposible estornudar con los ojos abiertos? punctuation adposition pronoun verb adjective verb adposition determiner noun verb punctuation,0
1404,@PitufoFilosofon  ¿Porque el programa se llama ''Bob Esponja'' si Patricio es la estrella? punctuation noun punctuation conjunction determiner noun pronoun verb punctuation noun punctuation conjunction noun verb determiner noun punctuation,0
1405,"Un taxista me dijo: ""Amo mi trabajo, soy mi propio jefe y nadie me dice qué hacer"". Y yo le contesté: ""Gire a la derecha, por favor"" ;) determiner noun pronoun verb punctuation punctuation verb determiner noun punctuation verb determiner adjective noun conjunction pronoun pronoun verb pronoun verb punctuation punctuation conjunction pronoun pronoun verb punctuation punctuation verb adposition determiner noun punctuation adverb punctuation punctuation punctuation",1
1406,"Típico, escuchar una canción en inglés y cantarla en todos los idiomas menos ese. noun punctuation verb determiner noun adposition noun conjunction verb pronoun adposition determiner determiner noun adverb determiner punctuation",0
1407,––¿Sabes cuál es la diferencia entre la pizza y tu opinión? ––¿Cuál? ––Que la pizza si la pedí. punctuation punctuation punctuation verb pronoun verb determiner noun adposition determiner noun conjunction determiner noun punctuation punctuation punctuation punctuation pronoun punctuation punctuation punctuation noun determiner noun conjunction pronoun verb punctuation,1
1408,RT @BonitosNovios: Sólo recuerda que yo estuve ahí cuando nadie más lo estuvo. noun punctuation noun punctuation adverb verb conjunction pronoun verb adverb conjunction pronoun adverb pronoun verb punctuation,0
1409,Cuando un niño miente está dejando salir a su adulto interior. conjunction determiner noun verb verb verb verb adposition determiner noun adjective punctuation,0
1410,Mi memoria es:  5% nombres  3% números telefónicos  2% asuntos del colegio  90% letras de canciones. determiner noun verb punctuation punctuation number noun punctuation number noun adjective punctuation number noun adposition determiner noun punctuation number noun adposition noun punctuation,0
1411,La felicidad consiste en: Dormir sin tener que madrugar. Comer sin engordar. &amp; aprobar sin estudiar. determiner noun verb adposition punctuation verb adposition verb pronoun verb punctuation verb adposition verb punctuation punctuation noun punctuation verb adposition verb punctuation,1
1412,"¿Me puedes enviar la presentación? — ¿Por fax? — Sí por fax, enviamelax. punctuation pronoun verb verb determiner noun punctuation punctuation punctuation adposition noun punctuation punctuation noun adposition noun punctuation noun punctuation",1
1413,"- ¿Cómo te fue en el examen? - ¡Mal! Deje la hoja en blanco, ¿y vos? -También - ¡Noooooooo! Van a pensar que nos copiamos punctuation punctuation pronoun pronoun verb adposition determiner noun punctuation punctuation punctuation adverb punctuation verb determiner noun adposition noun punctuation punctuation conjunction pronoun punctuation punctuation adverb punctuation punctuation noun punctuation verb adposition verb conjunction pronoun verb",1
1414,"-Te amo -Te amo -No, yo te amo más -No, yo te amo más -Ay, qué ridículo es jugar con el eco -Ay, qué ridículo es jugar con el eco. punctuation pronoun verb punctuation pronoun verb punctuation adverb punctuation pronoun pronoun verb adverb punctuation adverb punctuation pronoun pronoun verb adverb punctuation interjection punctuation determiner adjective verb verb adposition determiner noun punctuation interjection punctuation determiner adjective verb verb adposition determiner noun punctuation",1
1415,Llegar al colegio con ganas de irse verb adposition determiner noun adposition noun adposition verb pronoun,0
1416,"-Mamá, me saqué un 9 en Literatura -Que bien, te felicito hija. ¿Y en historia como te fue? -Me saqué un 9 en Literatura. punctuation noun punctuation pronoun verb determiner number adposition noun punctuation pronoun adverb punctuation pronoun verb noun punctuation punctuation conjunction adposition noun conjunction pronoun verb punctuation punctuation pronoun verb determiner number adposition noun punctuation",1
1417,RT @dianadagostino_: Estamos acompañando a los Maestros Hatillanos en la Sesión Solemne del Consejo Municipal por . Q orgu ... noun punctuation noun punctuation punctuation verb verb adposition determiner noun adposition determiner noun adposition punctuation noun noun punctuation,0
1418,"RT @dianadagostino_: ""El sabio no dice nunca todo lo que piensa, pero siempre piensa todo lo que dice"". -Aristóteles noun punctuation noun punctuation punctuation punctuation determiner noun adverb verb adverb determiner determiner pronoun verb punctuation conjunction adverb verb determiner determiner pronoun verb punctuation punctuation punctuation noun",0
1419, @Riete y te vuelo los dientes. punctuation noun conjunction pronoun verb determiner noun punctuation,0
1420,"Te gusta, no le gustas.

Le gustas, no te gusta.

Se  gustan , no se puede. pronoun verb punctuation adverb pronoun verb punctuation pronoun verb punctuation adverb pronoun verb punctuation pronoun verb punctuation adverb pronoun verb punctuation",1
1421,¿Qué le dijo el inodoro a Batman? Te conozco la bati-cueva. by @xlxn_pesina   punctuation pronoun pronoun verb determiner noun adposition noun punctuation pronoun verb determiner adjective punctuation noun punctuation noun,1
1422,Los celulares están programados para trabarse cuando más se necesitan. determiner adjective verb verb adposition verb pronoun conjunction adverb pronoun verb punctuation,0
1423,"-¿Doctor, que es lo que tengo? -Sabe como se dice ""dos más"" en inglés -¿Two more? -Exacto, tienes un two more maligno. punctuation punctuation noun punctuation pronoun verb determiner pronoun verb punctuation punctuation verb conjunction pronoun verb punctuation number adverb punctuation adposition noun punctuation punctuation noun verb punctuation punctuation interjection punctuation verb determiner noun verb adjective punctuation",0
1424,"‎-Doctor, no puedo pestañear -Tranquilo, ¡eso lo arreglamos en un abrir y cerrar de ojos! punctuation punctuation noun punctuation adverb verb verb punctuation noun punctuation punctuation pronoun pronoun verb adverb punctuation",1
1425,"Decir ""UUUUUUUUUUHHHHH"" para generar conflicto. verb punctuation noun punctuation adposition verb noun punctuation",1
1426,"-Pepe, tras 15 años de relaciones, ¿por qué no nos casamos? -¿Y quién nos va a querer?   punctuation noun punctuation adposition number noun adposition noun punctuation punctuation adposition pronoun adverb pronoun verb punctuation punctuation punctuation conjunction pronoun pronoun verb adposition verb punctuation",1
1427,"@PitufoFilosofon Pareja perfecta es la que vuelve a intentarlo, y lucha por estar juntos. punctuation noun adjective verb determiner pronoun verb adposition verb pronoun punctuation conjunction noun adposition verb adjective punctuation",0
1428,"Ir a la playa y preguntarle a una ola ""ke ase?"" verb adposition determiner noun conjunction verb pronoun adposition determiner noun punctuation noun verb punctuation punctuation",0
1429,Ese momento de inseguridad en un examen cuando usas la calculadora hasta para sumar 2+2. determiner noun adposition noun adposition determiner noun pronoun verb determiner noun adposition adposition verb punctuation,0
1430,- ¡No entres ahí imbécil! ¡No entres a esa iglesia! ¡NOOO! - ¿Qué película estás viendo mi vida? -El vídeo de nuestra boda. punctuation punctuation adverb verb adverb adjective punctuation punctuation adverb verb adposition determiner noun punctuation punctuation noun punctuation punctuation punctuation determiner noun verb verb determiner noun punctuation punctuation determiner noun adposition determiner noun punctuation,1
1431,"- Ayer, al salir del trabajo atropellé a un unicornio.
- No jodas, ¿tenes trabajo? punctuation adverb punctuation adposition determiner verb adposition determiner noun verb adposition determiner noun punctuation punctuation adverb verb punctuation punctuation noun noun punctuation",1
1432,Sacarse un dos y reírse del que se saco un uno verb pronoun determiner number conjunction verb pronoun adposition determiner pronoun pronoun verb determiner pronoun,0
1433,"Agarra el vaso y tíralo al suelo. Listo, ya ¿Se rompió? Sí Ahora pídele perdón Perdón. ¿Volvió a estar como antes? No. ¿Entendiste? punctuation noun determiner noun conjunction verb pronoun adposition determiner noun punctuation punctuation noun punctuation adverb punctuation punctuation pronoun verb punctuation punctuation noun punctuation noun verb pronoun noun punctuation noun punctuation punctuation punctuation verb adposition verb conjunction adverb punctuation punctuation noun punctuation punctuation punctuation verb punctuation",0
1434,"- ¿Por qué vas al velorio de tu tía disfrazado del perro de Mickey?  -Vos me lo dijiste - ¡DE LUTO TE DIJE, DE LUTO! punctuation punctuation adposition pronoun verb adposition determiner noun adposition determiner noun verb adposition determiner noun adposition noun punctuation punctuation pronoun pronoun pronoun verb punctuation punctuation noun punctuation noun punctuation",1
1435,"Mamá, mamá! en el colegio me dicen Shampoo -Tranquilo Johnson, No más Lágrimas! noun punctuation noun punctuation adposition determiner noun pronoun verb noun punctuation noun punctuation noun adverb noun punctuation",1
1436,"—¿Tan linda y sin novio? —JAJAJAJAJA, tonto, tu eres mi novio. —JAJAJAJAJAJAJA, te estoy cortando. —Ay :( punctuation punctuation adverb adjective conjunction adposition noun punctuation punctuation noun punctuation noun punctuation determiner verb determiner noun punctuation punctuation noun punctuation pronoun verb verb punctuation punctuation noun punctuation punctuation",1
1437,Típico: Tener las manos heladas y sentir la inmensa necesidad de demostrarlo. noun punctuation verb determiner noun noun conjunction verb determiner adjective noun adposition verb pronoun punctuation,0
1438,"No quiero ser toda tu vida, solo tu parte favorita... adverb verb verb determiner determiner noun punctuation adverb determiner noun adjective punctuation",0
1439,Tengo una amiga que le dicen la langosta... porque tiene toda la carne en la cola!  verb determiner noun pronoun pronoun verb determiner noun punctuation conjunction verb determiner determiner noun adposition determiner noun punctuation,1
1440,"Me encanta encontrar dinero en mi ropa, es como un regalo para mí de mí. pronoun verb verb noun adposition determiner noun punctuation verb conjunction determiner noun adposition pronoun adposition pronoun punctuation",0
1441,"Las mujeres con lunares o pecas, son doblemente hermosas. determiner noun adposition noun conjunction noun punctuation verb adverb adjective punctuation",0
1442,Pensar todo el día en dormir y a la hora de dormir pensar en todo el día verb determiner determiner noun adposition verb conjunction adposition determiner noun adposition verb verb adposition determiner determiner noun,0
1443,"—Bueno, ¿con quién quiere hablar? —Contigo. —Déjeme se lo paso, ¡TIGO, TE HABLAN! —No, pero... —Ya viene. —Espera... —Hola, habla Tigo punctuation noun punctuation punctuation adposition pronoun verb verb punctuation punctuation noun punctuation punctuation noun pronoun pronoun noun punctuation punctuation noun punctuation noun punctuation punctuation noun punctuation conjunction punctuation punctuation noun verb punctuation punctuation noun punctuation punctuation noun punctuation verb noun",1
1444,Típico: estudiar durante unos minutos y tomar descanso durante unas horas. noun punctuation verb adposition determiner noun conjunction verb noun adposition determiner noun punctuation,1
1445,"-Este año me pongo las pilas 
- ¿Hiciste la tarea? 
- ¿QUÉ? ¿HABÍA TAREA? punctuation determiner noun pronoun verb determiner noun punctuation punctuation verb determiner noun punctuation punctuation punctuation pronoun punctuation punctuation noun punctuation",1
1446,¿Los albañiles se van al cielo por sus buenas obras? punctuation determiner noun pronoun verb adposition determiner noun adposition determiner adjective noun punctuation,1
1447,"- ¡No te muevas! Tenes algo horrendo saliendo de tu cuello - ¿DÓNDE? ¡QUÍTAMELO! ¡QUÍTAMELO! -Ah no, es tu cara. punctuation punctuation adverb pronoun verb punctuation noun adverb adjective verb adposition determiner noun punctuation punctuation pronoun punctuation punctuation noun punctuation punctuation noun punctuation punctuation interjection adverb punctuation verb determiner noun punctuation",1
1448,¿Por qué las prostitutas se parecen a las autopistas? Porque o pagas o te vas por la vieja...  punctuation adposition pronoun determiner noun pronoun verb adposition determiner noun punctuation conjunction conjunction noun conjunction pronoun verb adposition determiner adjective punctuation,1
1449,RT @NewBirdVe: ¡¡Si eres uno de nuestros primeros 1.000 seguidores participarás para ganar el calzado NewBird que más te guste!!! ¡Danos ... noun punctuation noun punctuation punctuation punctuation conjunction verb pronoun adposition determiner adjective number noun verb adposition verb determiner noun noun pronoun adverb pronoun verb punctuation punctuation punctuation punctuation verb pronoun punctuation,0
1450,"Usar el ""jajaja"" como comodín cuando no sabes que contestar. verb determiner punctuation noun punctuation conjunction noun conjunction adverb verb conjunction verb punctuation",0
1451,"""Diciembre es el mes de los almuerzayunos."" punctuation date verb determiner noun adposition determiner noun punctuation punctuation",1
1452,"Cuando somos buenos, nadie nos recuerda; cuando somos malos, nadie nos olvida. conjunction verb adjective punctuation pronoun pronoun verb punctuation conjunction verb adjective punctuation pronoun pronoun verb punctuation",0
1453,—Jajajajajajajá. —¿De qué te ríes? —De tí. —¿Por qué? —Porque antes me gustabas. —¿Y ahora? —También :( punctuation noun punctuation punctuation punctuation adposition pronoun pronoun verb punctuation punctuation noun verb punctuation punctuation punctuation adposition pronoun punctuation punctuation noun adverb pronoun verb punctuation punctuation punctuation conjunction adverb punctuation punctuation noun punctuation punctuation,0
1454,"Doctor, ¿como se encuentra mi hijo, el que se tragó una moneda? -Sigue SIN CAMBIO, Sra.   noun punctuation punctuation conjunction pronoun verb determiner noun punctuation determiner pronoun pronoun verb determiner noun punctuation punctuation verb noun punctuation noun",1
1455,"Mis días pasan así:
-Luuuunneeeeeeeeeeeeees
-Maaaaaaaaaarteeeeeeeeees
-Mieeeeeeeeeeeeercoooooooleeeeeees
-Jueeeeeeveeeees
-VIERNESABADOMINGO determiner noun verb adverb punctuation punctuation noun punctuation noun punctuation noun punctuation noun punctuation noun",1
1456,Faltan cinco pa’ las doce el año va a terminar me voy corriendo a mi casa a abrazar a mi mamá... verb number noun punctuation determiner number determiner noun verb adposition verb pronoun verb verb adposition determiner noun adposition verb adposition determiner noun punctuation,0
1457,"Un hombre debe tener a una mujer bella, una mujer inteligente, una mujer simpática... y que no se conozcan entre ellas. determiner noun verb verb adposition determiner noun adjective punctuation determiner noun adjective punctuation determiner noun adjective punctuation conjunction conjunction adverb pronoun verb adposition pronoun punctuation",1
1458,"Lo Que siempre Quise Hacer Fue salir del salón de clases cuando el profesor decía ""A quién no le interese mi clase puede salir determiner noun adverb noun verb adposition determiner noun adposition noun conjunction determiner noun verb punctuation adposition pronoun adverb pronoun verb determiner noun verb verb",1
1459,"Conmigo no funciona el ""te ignoro para que te enamores"". A mi me ignoras y te vas a la mierda. pronoun adverb verb determiner punctuation pronoun verb adposition conjunction pronoun verb punctuation punctuation adposition determiner pronoun verb conjunction pronoun verb adposition determiner noun punctuation",1
1460,"- ¿Qué te pasa? -Nada -Decime -Nada, carajo -Dale decime -NADA - ¿Ya no me quieres verdad? -QUE NADES PENDEJA, ¡NOS VAMOS A AHOGAR! punctuation punctuation pronoun pronoun verb punctuation punctuation adverb punctuation noun punctuation pronoun punctuation noun punctuation verb pronoun adjective punctuation adverb punctuation punctuation adverb adverb pronoun verb noun punctuation punctuation noun punctuation punctuation noun punctuation",1
1461,"- ¿A qué te dedicas? -Soy delantero -Ah, ¿jugas al fútbol? -No, vendo delantales punctuation punctuation adposition pronoun pronoun verb punctuation punctuation verb adjective punctuation interjection punctuation punctuation noun adposition determiner noun punctuation punctuation adverb punctuation verb noun",1
1462,No hacer nada en todo el día. Sentirse culpable. Seguir sin hacer nada. adverb verb pronoun adposition determiner determiner noun punctuation verb pronoun adjective punctuation verb adposition verb pronoun punctuation,0
