,text,category
0,-La semana pasada mi hijo hizo un triple salto mortal desde 20 metros de altura - ¿Es trapecista? -Era :( punctuation determiner noun verb determiner noun verb determiner adjective noun adjective adposition number adposition noun punctuation punctuation verb noun punctuation punctuation verb punctuation punctuation,1
1,"-Yo ya voy por mi segundo millón de dólares... -¿!Ah, si!? -Es que el primero nunca lo hice...  punctuation pronoun adverb verb adposition determiner adjective noun adposition noun punctuation punctuation punctuation punctuation interjection punctuation conjunction punctuation punctuation punctuation verb conjunction determiner adjective adverb pronoun verb punctuation",0
2,-Ayer fue mi cumpleaños y no me felicitaste - ¡FéÉLíCÍDáÁDÉéS! - ¿Qué haces? -Felicitarte con retraso. punctuation adverb verb determiner noun conjunction adverb pronoun verb punctuation punctuation noun punctuation punctuation punctuation determiner noun punctuation punctuation verb pronoun adposition noun punctuation,1
3,"No es flojera, es un estado de ahorro de energía corporal :) adverb verb noun punctuation verb determiner noun adposition noun adposition noun adjective punctuation punctuation",1
4,- ¿Cómo te fue en matemática? -Vos sabes que soy muy pacífica - ¿Y eso qué tiene que ver? -No me gustan los problemas jajaja -Castigada - :( punctuation punctuation pronoun pronoun verb adposition noun punctuation punctuation pronoun verb conjunction verb adverb adjective punctuation punctuation conjunction pronoun pronoun verb conjunction verb punctuation punctuation adverb pronoun verb determiner noun adjective punctuation verb punctuation punctuation punctuation,0
5,"-Compadre, su hija antes me daba como por las rodillas, ahora me da hasta las nalgas!  punctuation noun punctuation determiner noun adverb pronoun verb conjunction adposition determiner noun punctuation adverb pronoun verb adposition determiner noun punctuation",1
6,Había una vez una tortuguita que fue a su primer día de clases y cuando llegó… ¡Ya estaban de vacaciones! verb number noun determiner noun pronoun verb adposition determiner adjective noun adposition noun conjunction conjunction verb punctuation punctuation adverb verb adposition noun punctuation,1
7,"Una novia que sea tan delicada como Neymar, eso es lo que quiero. determiner noun pronoun verb adverb adjective conjunction noun punctuation pronoun verb determiner pronoun verb punctuation",0
8,¿Qué le dice el Nesquik a la leche? ¡Te voy a echar un polvo que te va a cambiar el color!   punctuation pronoun pronoun verb determiner noun adposition determiner noun punctuation punctuation pronoun verb adposition verb determiner noun pronoun pronoun verb adposition verb determiner noun punctuation,1
9,"Si oscar se queda me pego un tiro con un banano, a vd y apago el tv xD (Mateo) conjunction noun pronoun verb pronoun verb determiner noun adposition determiner noun punctuation adposition noun conjunction verb determiner noun noun punctuation verb punctuation",0
10,"- ¿Cual es tu nombre? -Pikachu Rodríguez, ¿y el tuyo? -Pablo - ¡No me jodas! ¿Como el de los picapiedras? punctuation punctuation pronoun verb determiner noun punctuation punctuation noun punctuation punctuation conjunction determiner adjective punctuation punctuation verb punctuation punctuation adverb pronoun verb punctuation punctuation conjunction determiner adposition determiner noun punctuation",1
11,"Encerrarse a llorar en silencio, respirar, lavarse la cara, salir y poner esa sonrisa de ""Todo está perfecto, no me pasa NADA!"". verb pronoun adposition verb adposition noun punctuation verb punctuation verb pronoun determiner noun punctuation verb conjunction verb determiner noun adposition punctuation pronoun verb adjective punctuation adverb pronoun verb noun punctuation punctuation punctuation",0
12,¿Cuál es la diferencia entre cualquier adolescente y E.T.?  Que E.T. llamaba a la casa... by @hadacon  punctuation pronoun verb determiner noun adposition determiner noun conjunction noun punctuation conjunction noun verb adposition determiner noun punctuation noun punctuation noun,1
13,"Llegada inoportuna de gente a tu casa, que te obliga a vestirte... noun adjective adposition noun adposition determiner noun punctuation pronoun pronoun verb adposition verb pronoun punctuation",0
14,"La vida es corta... sonríele a quien llora, ignora a quien te critica y sé feliz con quien te importa. determiner noun verb adjective punctuation verb pronoun adposition pronoun verb punctuation verb adposition pronoun pronoun verb conjunction verb adjective adposition pronoun pronoun verb punctuation",0
15,"-Por vos iría hasta el fin del mundo -Ayyy ♥ ¿en serio? -Sí, con tal de alejarme de vos, ¡feo! punctuation adposition pronoun verb adposition determiner noun adposition determiner noun punctuation noun punctuation punctuation adposition adjective punctuation punctuation adverb punctuation adposition verb pronoun adposition pronoun punctuation punctuation adjective punctuation",1
16,"Hay cosas que no se deberían romper jamás: Las promesas, los corazones, los condones. verb noun pronoun adverb pronoun verb verb adverb punctuation determiner noun punctuation determiner noun punctuation determiner noun punctuation",1
17,RT @TodoReflexion: Los bosques serían demasiado silenciosos si cantaran sólo los pájaros que mejor lo hacen noun punctuation noun punctuation determiner noun verb adverb adjective conjunction verb adverb determiner noun pronoun adverb pronoun verb,0
18,"—Mamá, mi novia me mandó a la mierda. :( 
—Ponte suéter o no vas. punctuation noun punctuation determiner noun pronoun verb adposition determiner noun punctuation punctuation punctuation punctuation noun noun conjunction adverb verb punctuation",1
19,"Una madre a su hija: -Es tan desagradable tu último novio, ¡que seré su suegra con verdadero placer!   determiner noun adposition determiner noun punctuation punctuation verb adverb adjective determiner adjective noun punctuation punctuation conjunction verb determiner noun adposition adjective noun punctuation",1
20,"Si no eres mala influencia, fracasaste como mejor amigo. conjunction adverb verb adjective noun punctuation verb conjunction adjective noun punctuation",1
21,"- ¿Qué haces en tu tiempo libre? -Soy asesina en serie - ¿En serio? -No, en serie. punctuation punctuation determiner noun adposition determiner noun adjective punctuation punctuation verb adjective adposition noun punctuation punctuation adposition adjective punctuation punctuation adverb punctuation adposition noun punctuation",1
22,@coketaboada Jajajaja lolazo. punctuation noun noun noun punctuation,0
23,RT @TipsKids: Modales en la mesa: Plantéate qué modales para la mesa son más importantes para ti y lo que quieres que tus hijos aprendan y … noun punctuation noun punctuation noun adposition determiner noun punctuation verb pronoun determiner noun adposition determiner noun verb adverb adjective adposition pronoun conjunction determiner pronoun verb conjunction determiner noun verb conjunction punctuation,0
24,"RT @AnaBuilesC: ""Mateo al 6565"" ya se cagaron la hpta noche con este hpta HT de veras que ustedes valen mnd!!! Partidaas de brutos! noun punctuation noun punctuation punctuation verb adposition determiner number punctuation adverb pronoun verb determiner noun noun adposition determiner noun noun adposition noun pronoun pronoun verb noun punctuation punctuation punctuation noun adposition adjective punctuation",0
25,"A mi también me dijeron ""te debo el regalo"" y todavía lo estoy esperando adposition determiner adverb pronoun verb punctuation pronoun verb determiner noun punctuation conjunction adverb pronoun verb verb",0
26,Mi padre es un viejo verde. (El increíble Hulk)   determiner noun verb determiner adjective adjective punctuation punctuation determiner adjective noun punctuation,1
27,"El TT' Original era: The Beatles Nuestros Idolos, Algunos metiron mal el dedo y escribieron: Wisin y Yandel Nuestros Idolos (HP Regayton). determiner noun punctuation adjective verb punctuation noun punctuation noun verb adverb determiner noun conjunction verb punctuation noun conjunction noun punctuation noun punctuation punctuation",0
28,A mi no me asustan tipos lenguas largas... (Atte. El Clitoris) by @tokesitodeldia  adposition determiner adverb pronoun verb noun noun adjective punctuation punctuation noun punctuation noun punctuation adjective,1
29,"-Papá, ¿me das $100? 
- ¿QUE? ¿Qué te de $50? ¿Para qué queres $30 si con $20 es suficiente? Toma $10 y dale $5 a tu hermano. punctuation noun punctuation punctuation pronoun verb number punctuation punctuation punctuation pronoun punctuation punctuation pronoun pronoun adposition number punctuation punctuation adposition pronoun verb number conjunction adposition number verb adjective punctuation verb number conjunction verb pronoun number adposition determiner noun punctuation",1
30,"— Oye, ¿cómo se escribe nariz en inglés? — NOSE — ¿Tú tampoco?. Mierda, nadie lo sabe... punctuation noun punctuation punctuation pronoun pronoun verb noun adposition noun punctuation punctuation noun punctuation punctuation pronoun adverb punctuation punctuation noun punctuation pronoun pronoun verb punctuation",1
31,"El día que nosotros gobernemos, todos temblarán. (Un epiléptico)    determiner noun pronoun pronoun verb punctuation pronoun verb punctuation punctuation determiner noun punctuation",1
32,"El vodka es como el agua, pero con superpoderes. determiner noun verb conjunction determiner noun punctuation conjunction adposition noun punctuation",1
33,Nunca es tarde para seguir durmiendo adverb verb noun adposition verb verb,1
34,La mayoría de los hombres joden demasiado hasta lograr un «SI » y luego no saben qué hacer con él. determiner noun adposition determiner noun verb adverb adposition verb determiner punctuation conjunction punctuation conjunction adverb adverb verb pronoun verb adposition pronoun punctuation,1
35,Perdida inmediata de la dignidad al intentar subir un escalón invisible verb adjective adposition determiner noun adposition determiner verb verb determiner noun adjective,1
36,"TE CONQUISTARIA, pero no soy Cristóbal colon :( noun punctuation conjunction adverb verb noun noun punctuation punctuation",1
37,"El optimista piensa que este es el mejor de los mundos posibles, y el pesimista teme que eso sea verdad.   determiner adjective verb conjunction pronoun verb determiner adjective adposition determiner noun adjective punctuation conjunction determiner noun verb conjunction pronoun verb noun punctuation",0
38,Dicen que la tele engorda... ¡por eso no como tele!  by @leoidair   verb conjunction determiner noun verb punctuation punctuation adposition pronoun adverb conjunction noun punctuation noun punctuation verb,1
39,"—Oye, ¿me prestas tu baño? —Si ¿Necesitas papel higiénico? —No te preocupes, solo me quiero tomar unas fotos para mi perfil.  punctuation noun punctuation punctuation pronoun verb determiner noun punctuation punctuation noun punctuation verb noun adjective punctuation punctuation noun pronoun verb punctuation adverb pronoun verb verb determiner noun adposition determiner noun punctuation",1
40, ¿QHèEé TíèEënêé èLLáà QèEë nóHOò tènNGgàä yHOóòò?  La primaria terminada. punctuation punctuation noun verb noun verb adverb noun punctuation punctuation noun adjective verb punctuation,1
41,- ¿Y el novio hija? - ¿Y los dientes abuela? punctuation punctuation conjunction determiner noun noun punctuation punctuation punctuation conjunction determiner noun noun punctuation,1
42,"—Hola perra, ¿Cómo estás?  —¡No me digas así! *Le da una cachetada*   —Oh que fuerza, debe ser por . punctuation noun noun punctuation punctuation pronoun verb punctuation punctuation punctuation adverb pronoun verb adverb punctuation punctuation noun verb determiner noun punctuation punctuation noun conjunction noun punctuation verb verb adposition punctuation",1
43,"Escuchar a alguien hablar y pensar: ""deja de mentir"". verb adposition pronoun verb conjunction verb punctuation punctuation verb adposition verb punctuation punctuation",0
44,Hoy comer mole... Y mañana hacer pescado... Pescado del toallero... by @nutri_mona   adverb verb noun punctuation conjunction adverb verb noun punctuation noun adposition determiner noun punctuation noun punctuation noun,0
45,ABURRIDORA: Persona que habla cuando queremos que escuche. -Ambrose Bierce   noun punctuation noun pronoun verb conjunction verb conjunction verb punctuation punctuation noun,0
46,Errar es de humanos dijo el pato y se bajó de la gallina. Perdonar es divino dijo la gallina y salió corriendo detrás del pato.  verb verb adposition adjective verb determiner noun conjunction pronoun verb adposition determiner noun punctuation verb verb adjective verb determiner noun conjunction verb verb adposition determiner noun punctuation,1
47,"RT @MuyCuriosoES: Microsoft gasta más atendiendo llamadas de sus usuarios con problemas, que produciendo sus programas. noun punctuation noun punctuation noun verb adverb verb noun adposition determiner noun adposition noun punctuation pronoun verb determiner noun punctuation",0
48,Yo también acabo riéndome cuando intento hacerme el dormido. pronoun adverb verb verb pronoun conjunction verb verb pronoun determiner verb punctuation,1
49,"Los hombres son excelentes cocineros. Con 2 huevos, 1 salchicha y un poco de leche, llenan la panza de una mujer por 9 meses by @edwinxs determiner noun verb adjective noun punctuation adposition number noun punctuation number noun conjunction determiner pronoun adposition noun punctuation verb determiner noun adposition determiner noun adposition number noun noun punctuation noun",1
50,"De niños todos éramos amigos, hasta que llegaba la hora de la piñata. adposition noun pronoun verb noun punctuation adposition pronoun verb determiner noun adposition determiner noun punctuation",0
51,—Antes de fusilarlo ¿quiere decir algo? —Sí. Algo ¡JAJAJÁ! —¿Divertido? —Vertido ¡JAJAJAJAJÁ! —¡DISPAREEEN! —¡SPAREEEN! ¡JAJAJAJAJAJÁ! punctuation noun verb pronoun punctuation verb verb pronoun punctuation punctuation noun punctuation pronoun punctuation interjection punctuation punctuation punctuation verb punctuation punctuation noun punctuation noun punctuation punctuation punctuation noun punctuation punctuation punctuation noun punctuation punctuation noun punctuation,1
52,"No estoy en contra de que haya mujeres feas, pero ¿por qué todas viven en esta cuidad?    adverb verb adposition conjunction verb noun adjective punctuation conjunction punctuation adposition pronoun determiner verb adposition pronoun verb punctuation",1
53,Típico: Ir por la calle y sonreirle a un recuerdo que se cruzó por tu mente. noun punctuation verb adposition determiner noun conjunction verb adposition determiner noun pronoun pronoun verb adposition determiner noun punctuation,0
54,"—¿Te pusieron brackets? —NOOO PENDEJO, vino MTV y me enchulo la boca. JaaJaa punctuation punctuation pronoun verb noun punctuation punctuation noun punctuation verb noun conjunction pronoun verb determiner noun punctuation noun",1
55,Típico: Salir de casa sin peinarte y sonreír porque sabes que igual eres guapo. noun punctuation verb adposition noun adposition verb pronoun conjunction verb conjunction verb conjunction adverb verb adjective punctuation,0
56,"- ¿Cómo van los estudios? - ¿Podemos hablar de otra cosa? -Ok, ¿y el novio? -Bueno los profesores no son muy buenos que digamos… punctuation punctuation pronoun verb determiner noun punctuation punctuation punctuation verb verb adposition determiner noun punctuation punctuation noun punctuation punctuation conjunction determiner noun punctuation punctuation interjection determiner noun adverb verb adverb adjective conjunction verb punctuation",1
57,"Tras revisar al esposo, el Dr dice a la mujer: -El aspecto de su marido no me gusta -A mi tampoco pero es bueno con mis hijos! adposition verb adposition determiner noun punctuation determiner noun verb adposition determiner noun punctuation punctuation determiner noun adposition determiner noun adverb pronoun verb punctuation adposition determiner adverb conjunction verb adjective adposition determiner noun punctuation",1
58,Todos los días me levanto con más sueño que cuando me fui a dormir determiner determiner noun pronoun verb adposition adverb noun conjunction conjunction pronoun verb adposition verb,1
59,"-Hola, ¿con la fabrica de fieles? -Si -Hagan más, porque ya quedamos pocos punctuation interjection punctuation punctuation adposition determiner verb adposition noun punctuation punctuation conjunction punctuation verb adverb punctuation conjunction adverb verb determiner",1
60,Típico: Te levantas de noche para ir al baño y corres lo más veloz que puedes para que el fantasma no te alcance :( noun punctuation pronoun verb adposition noun adposition verb adposition determiner noun conjunction verb determiner adverb adjective pronoun verb adposition conjunction determiner noun adverb pronoun verb punctuation punctuation,1
61,"Colombia, No voten por pesar, o por que los haga reir, Voten Por que su conciencia lo diga, Mateo Tiene talento por favor Oscar a el 6565 noun punctuation noun verb adposition verb punctuation conjunction adposition conjunction pronoun verb verb punctuation noun conjunction determiner noun pronoun verb punctuation noun noun adverb noun adposition determiner number",0
62,—Tengo frío. —Pero si es verano. —Pero hace frío... —Pero si hace 40 grados. —¡ABRÁZAME IDIOTA! punctuation noun noun punctuation punctuation noun conjunction verb noun punctuation punctuation noun verb adjective punctuation punctuation noun conjunction verb number noun punctuation punctuation punctuation noun punctuation,1
63,¿Alcohólico yo? JAJAJAJAJA ¡Para nada! Cada año solo bebo en 2 ocasiones: Cuando es mi cumpleaños y cuando no lo es. punctuation adjective pronoun punctuation noun punctuation adposition pronoun punctuation determiner noun adjective verb adposition number noun punctuation conjunction verb determiner noun conjunction conjunction adverb pronoun verb punctuation,1
64,"Oye, hija, ¿Trabajas en Monsters Inc.? No Mamá, ¿Por qué? ¿Y ese monstruo? ¡Mamá!, deja en paz a mi novio.  ¡33:12! ¡Tenemos un 33:12!. punctuation noun punctuation noun punctuation punctuation verb adposition noun punctuation punctuation noun punctuation punctuation adposition pronoun punctuation punctuation punctuation conjunction determiner noun punctuation punctuation punctuation noun punctuation punctuation verb adposition noun adposition determiner noun punctuation punctuation punctuation number punctuation punctuation verb determiner number punctuation punctuation",1
65,"Nueva promoción de Microsoft: Con tu Windows 7, de regalo 3 botones de RESET de repuesto.   adjective noun adposition noun punctuation adposition determiner noun number punctuation adposition noun number noun adposition noun adverb punctuation",1
66,¡Nada es imposible! ¿No han visto como Bob Esponja hace una fogata bajo el agua? punctuation adverb verb adjective punctuation punctuation adverb verb verb conjunction noun verb determiner noun adposition determiner noun punctuation,0
67,El amor es el único deporte que no se suspende por falta de luz...  determiner noun verb determiner adjective noun pronoun adverb pronoun verb adposition noun adposition noun punctuation,0
68,"Típico: Mi profesora siempre decía: ""ese grupito de allá atrás se me separa"" noun punctuation determiner noun adverb verb punctuation punctuation determiner noun adposition adverb adverb pronoun pronoun verb punctuation",0
69,"-Como te llamas? -Anastasia, y me dicen Ana, tu? -Catalina, y me dicen Cata, y tu? -Penélope, pero no tengo apodo! by @DuendeUrbano punctuation conjunction pronoun noun punctuation punctuation noun punctuation conjunction pronoun verb noun punctuation determiner punctuation punctuation noun punctuation conjunction pronoun verb noun punctuation conjunction determiner punctuation punctuation noun punctuation conjunction adverb verb noun punctuation noun punctuation noun",1
70,"Si en las cajas de cigarrillos en vez de fotos de muertos pusieran: ""Estás ayudando al gobierno con $5"", todos dejarían de fumar. conjunction adposition determiner noun adposition noun adposition noun adposition noun verb punctuation punctuation verb verb adposition determiner noun adposition number punctuation punctuation pronoun verb adposition verb punctuation",0
71, La gente se detenga a saludarme. determiner noun pronoun verb adposition verb pronoun punctuation,0
72,"Voy a estudiar, Oh una mosca Voy a estudiar, Tengo un WhatsApp Voy a estudiar, Primero me baño Voy a estudiar, pff ya es tarde, mañana verb adposition verb punctuation noun determiner noun noun adposition verb punctuation noun adposition verb punctuation noun pronoun verb noun adposition verb punctuation noun adverb verb adverb punctuation adverb",0
73,"Un pistolero enojado dice a otro: -Oye, que tu andas diciendo que nosotros nos besamos? -No -Entonces nos vieron! by @rodrydi  determiner noun verb verb adposition pronoun punctuation punctuation verb punctuation conjunction determiner noun verb conjunction pronoun pronoun verb punctuation punctuation adverb punctuation adverb pronoun verb punctuation noun punctuation noun",1
74,"-Me vuelves a decir gorda y te dejo -No, mi amor, piensa en el bebé -¿Cual bebé? -Ah, ¿No estás embarazada? punctuation pronoun verb adposition verb noun conjunction pronoun verb punctuation adverb punctuation determiner noun punctuation verb adposition determiner noun punctuation punctuation pronoun noun punctuation punctuation interjection punctuation punctuation adverb verb verb punctuation",1
75,"-Oye, ¿a ti te ayudan a sentarte? -No, me siento sola -¡LO SABÍA! Sabía que aún me extrañabas. punctuation verb punctuation punctuation adposition pronoun pronoun verb adposition verb pronoun punctuation punctuation adverb punctuation pronoun verb adjective punctuation punctuation noun punctuation verb conjunction adverb pronoun verb punctuation",1
76,Un buen amigo es el que te da consejos durante horas sabiendo que no los vas a seguir. determiner adjective noun verb determiner pronoun pronoun verb noun adposition noun verb conjunction adverb determiner noun adposition verb punctuation,0
77,"-Hola, ¿cómo te llamas? -María de los Ángeles, ¿y vos? -Pedro de New York punctuation interjection punctuation punctuation pronoun pronoun noun punctuation punctuation noun punctuation punctuation conjunction pronoun punctuation punctuation noun",1
78,"-Te amo -Tranquila, ya se te va a pasar… punctuation pronoun verb punctuation adjective punctuation adverb pronoun pronoun verb adposition verb punctuation",1
79,La verdadera siesta es cuando te levantas y no te acordas ni del nombre de tu mamá determiner adjective noun verb conjunction pronoun verb conjunction adverb pronoun noun conjunction adposition determiner noun adposition determiner noun,0
80,"Escuchar los pasos de tu mamá, bloquear el celular y hacerte el dormido. verb determiner noun adposition determiner noun punctuation verb determiner adjective conjunction verb pronoun determiner verb punctuation",0
81,"-Mami, ¿hay gelatinaa? -No hija, solo hay i latina e y griega... by @Jkay282   punctuation noun punctuation punctuation verb noun punctuation punctuation adverb noun punctuation adverb verb noun adjective conjunction conjunction adjective punctuation noun punctuation number",1
82,"Admítelo, tu también dijiste: ""Mamá, si me compras esto, nunca mas te vuelvo a pedir nada"" verb pronoun punctuation determiner adverb verb punctuation punctuation noun punctuation conjunction pronoun verb pronoun punctuation adverb conjunction pronoun verb adposition verb pronoun punctuation",0
83,"-Hola, perdón por el retraso -No te preocupes, sé que naciste así. ¿Pero por qué llegaste tarde? punctuation interjection punctuation noun adposition determiner noun punctuation adverb pronoun verb punctuation verb conjunction verb adverb punctuation punctuation conjunction adposition pronoun verb noun punctuation",1
84,"Mi viejo me dice ""tráeme rápido el coso que está en el coso"" y yo no entiendo y corro en círculos persiguiéndome la cola. determiner adjective pronoun verb punctuation verb pronoun adverb determiner noun pronoun verb adposition determiner noun punctuation conjunction pronoun adverb verb conjunction noun adposition noun verb pronoun determiner noun punctuation",1
85,"- ¿Qué estas tomando? -Agua, mamá -A ver... Esto no es agua, es vino - ¡ALABADO SEA EL SEÑOR! punctuation punctuation pronoun pronoun verb punctuation punctuation noun punctuation noun punctuation adposition verb punctuation pronoun adverb verb noun punctuation verb noun punctuation punctuation noun punctuation",1
86,"Típico : Contestar ""¿Qué?"" para tener tiempo de pensar una respuesta creíble. noun punctuation verb punctuation punctuation pronoun punctuation punctuation adposition verb noun adposition verb determiner noun adjective punctuation",1
87,"Si amas a alguien, drógalo con cloroformo y átalo en tu cama. Si se queda, es tuyo; si logra huir, dispárale mientras corre. conjunction noun adposition pronoun punctuation verb pronoun adposition noun conjunction verb pronoun adposition determiner noun punctuation conjunction pronoun verb punctuation verb adjective punctuation conjunction verb verb punctuation verb pronoun conjunction verb punctuation",1
