,text,category
1995,Dale RT si tienes Amigos que escriben así en Whatsapp. verb pronoun noun conjunction verb noun pronoun verb adverb adposition noun punctuation,0
1996,"""Nunca sabes lo que tienes hasta que lo pierdes"". Corrección: Siempre lo supiste, pero nunca pensaste que lo perderías. BUEN DIA punctuation adverb verb determiner pronoun verb adposition conjunction pronoun verb punctuation punctuation noun punctuation adverb pronoun verb punctuation conjunction adverb verb conjunction pronoun verb punctuation noun",0
1997,"—Te Quiero Pero como amigos.
—¿Comes amigos?
—Jaja, no, tú y yo.
—¿Tú y yo comemos amigos?
—¡Que seamos amigos!
—¿¿Y nos comemos??
—¡NO!NO!! punctuation noun conjunction noun punctuation punctuation punctuation verb noun punctuation punctuation noun punctuation adverb punctuation pronoun conjunction pronoun punctuation punctuation punctuation pronoun conjunction pronoun verb noun punctuation punctuation punctuation conjunction verb noun punctuation punctuation punctuation punctuation conjunction pronoun verb punctuation punctuation punctuation punctuation adverb punctuation adverb punctuation punctuation",1
1998,"—Mamá, mi hermana lambió mi comida. —No hijo, lamió. —¿La mió? Hija de su chingada madre. punctuation noun punctuation determiner noun verb determiner noun punctuation punctuation noun noun punctuation verb punctuation punctuation punctuation pronoun verb punctuation noun adposition determiner verb noun punctuation",1
1999,"Con mi mujer siempre caminamos cogidos de la mano. Si la suelto, se va de compras  adposition determiner noun adverb verb verb adposition determiner noun punctuation conjunction determiner adjective punctuation pronoun verb adposition noun",1
2000,"- ¿Sabes cuál es la calle más silenciosa? -No, ¿cuál es? -La calle C JAJAJAJAJA no te vayas, no tengo amigos :( punctuation punctuation verb pronoun verb determiner noun adverb adjective punctuation punctuation adverb punctuation punctuation pronoun verb punctuation punctuation determiner noun noun adverb pronoun noun punctuation adverb verb noun punctuation punctuation",1
2001,"En la amistad prefiero ""calidad"" antes que ""cantidad"". adposition determiner noun verb punctuation noun punctuation adverb conjunction punctuation noun punctuation punctuation",1
2002,Un queso parmesano se ralló porque la esposa que estaba ricotta termino de mozarella de un campesino... by @DrGoyo   determiner noun adjective pronoun verb conjunction determiner noun pronoun verb noun verb adposition noun adposition determiner noun punctuation noun punctuation noun,1
2003,RT @LaBallenaLlena: ¿Arreglarse y llegar tarde o salir como loca y llegar a tiempo?  noun punctuation noun punctuation punctuation verb pronoun conjunction verb noun conjunction verb conjunction adjective conjunction verb adposition noun punctuation,0
2004,Un ladrón tan tonto que cuando iba a robar a las tiendas se llevaba los maniquíes para que no quedase ningún testigo. determiner noun adverb adjective conjunction conjunction verb adposition verb adposition determiner noun pronoun verb determiner noun adposition conjunction adverb verb determiner noun punctuation,1
2005,¿BONITO? Bonito es despertar con un mensaje de buenos dias. punctuation adjective punctuation adjective verb verb adposition determiner noun adposition adjective noun punctuation,0
2006,Google Earth nos permite explorar el mundo entero y siempre terminamos buscando nuestra casa :| noun pronoun verb verb determiner noun adjective conjunction adverb verb verb determiner noun punctuation punctuation,1
2007,"-Papá, ¿qué se siente tener un hijo tan lindo? -No sé hijo, pregúntale a tu abuelo. punctuation noun punctuation punctuation pronoun pronoun verb verb determiner noun adverb adjective punctuation punctuation adverb verb noun punctuation verb pronoun adposition determiner noun punctuation",1
2008,"Ódiame tú, yo no tengo tiempo. verb pronoun pronoun punctuation pronoun adverb verb noun punctuation",0
2009,Típico : Empieza a llover y tu mama grita.... La ropaaaaaaa!! noun punctuation verb adposition verb conjunction determiner noun noun punctuation noun noun punctuation punctuation,0
2010,RT @KlipXtreme: Se uno de nuestros primeros 500 seguidores y participa por docenas de accesorios tecnológicos ¿Qué esperas?  noun punctuation noun punctuation pronoun pronoun adposition determiner adjective number noun conjunction verb adposition noun adposition noun adjective punctuation determiner noun punctuation,0
2011,"Los teléfonos móviles serán inteligentes el día en que te digan ""Yo no mandaría ese mensaje si fuera tú"". determiner noun adjective verb adjective determiner noun adposition conjunction pronoun verb punctuation pronoun adverb verb determiner noun conjunction adverb pronoun punctuation punctuation",1
2012,"""Este sí va a ser mi año."" —Todos en todo el mundo. punctuation pronoun pronoun verb adposition verb determiner noun punctuation punctuation punctuation noun adposition determiner determiner noun punctuation",0
2013,Nada mejor que recordar viejos tiempos y reírse de las locuras que hacías con tus amigos. pronoun adverb conjunction verb adjective noun conjunction verb pronoun adposition determiner noun pronoun verb adposition determiner noun punctuation,0
2014,"-Decile vos -No, decile vos, es tu mamá -Pero a mi me va a decir que no, dale decile vos -Bueno, pero acompáñame. punctuation noun pronoun punctuation adverb punctuation noun pronoun punctuation verb determiner noun punctuation conjunction adposition determiner pronoun verb adposition verb conjunction adverb punctuation verb pronoun noun pronoun punctuation interjection punctuation conjunction verb pronoun punctuation",1
2015,"En la vida no se pierden amigos, solo descubrimos quienes son los verdaderos. adposition determiner noun adverb pronoun verb noun punctuation adverb verb pronoun verb determiner adjective punctuation",1
2016,RT @ElSaborDelCafe: ¿Sabías que…? La palabra ‘cappuccino’ proviene de la semejanza entre la bebida y elatuendo de los monjes capuchinos. noun punctuation noun punctuation punctuation verb conjunction punctuation punctuation determiner noun punctuation noun punctuation verb adposition determiner noun adposition determiner noun conjunction verb adposition determiner noun adjective punctuation,0
2017,Típico : Apagar la luz del pasillo y correr lo más rápido posible para que nadie te asesine. noun punctuation verb determiner noun adposition determiner noun conjunction verb determiner adverb adjective adjective adposition conjunction pronoun pronoun verb punctuation,1
2018,"Lo que no te mata, te hace mas pequeño -Mario Bros.  determiner pronoun adverb pronoun verb punctuation pronoun verb conjunction adjective punctuation noun",1
2019,"¿Extrañarte? Jajajajaja ni que fueras... Bueno si, si te extraño :( punctuation verb pronoun punctuation noun conjunction verb punctuation interjection conjunction punctuation conjunction pronoun verb punctuation punctuation",1
2020,"RT @ChisteUniversal: ¡PUTA DISTANCIA! Hijo, ¿ya estas enamorado otra vez? No mamá, el cable del cargador no llega hasta mi cama. noun punctuation noun punctuation punctuation noun punctuation punctuation noun punctuation punctuation adverb determiner noun determiner noun punctuation punctuation noun noun punctuation determiner noun adposition determiner noun adverb verb adposition determiner noun punctuation",1
2021,"A mi también me dijeron ""TE DEBO TU REGALO"" y hasta ahora lo estoy esperando ¬¬ adposition determiner adverb pronoun verb punctuation noun punctuation conjunction adposition adverb pronoun verb verb punctuation punctuation",0
2022,Nunca discutas con una mujer que escribe más rápido que tú. adverb verb adposition determiner noun pronoun verb adverb adjective conjunction pronoun punctuation,1
2023,"-Cuando el viudo Ruiz murió, dejó todo lo que tenía al orfanato -Oye, qué generoso -No. Lo único que tenía eran sus 12 hijos.  punctuation conjunction determiner noun noun verb punctuation verb determiner determiner pronoun verb adposition determiner noun punctuation verb punctuation pronoun adjective punctuation adverb punctuation determiner adjective pronoun verb verb determiner number noun punctuation",1
2024,¿Cuál es la diferencia entre el ACNÉ y un sacerdote? El acné no ataca a chicos de 8 años. by @hadacon  punctuation pronoun verb determiner noun adposition determiner noun conjunction determiner noun punctuation determiner noun adverb verb adposition noun adposition number noun punctuation noun punctuation noun,0
2025,"-Mi novio y yo tenemos una relación seria - ¿Llevan mucho tiempo de novios? -No, solo 3 días, pero no nos reímos. punctuation determiner noun conjunction pronoun verb determiner noun adjective punctuation punctuation verb determiner noun adposition noun punctuation punctuation adverb punctuation adverb number punctuation conjunction adverb pronoun verb punctuation",1
2026,"-¿Es abogado? -Sí -¿Cuanto cobra? -5000 por 3 preguntas -Caro, ¿no? -Sí pero las próximas 3 se las dejo en 3000  punctuation punctuation verb noun punctuation punctuation adverb punctuation punctuation adverb verb punctuation number adposition number noun punctuation adjective punctuation punctuation adverb punctuation punctuation pronoun conjunction determiner adjective number pronoun determiner noun adposition number",1
2027,No hay traición más grande que decir quién fue el que te dio el chicle. adverb verb noun adverb adjective conjunction verb pronoun verb determiner pronoun pronoun verb determiner noun punctuation,0
2028,"Una mujer tan fea, tan fea que le dicen la tortilla de arriba... Porque todos la manosean pero nadie se la come... by @riczamorano determiner noun adverb adjective punctuation adverb adjective pronoun pronoun verb determiner noun adposition adverb punctuation conjunction pronoun pronoun verb conjunction pronoun pronoun pronoun verb punctuation noun punctuation noun",1
2029,"Baby, baby, ohh! baby, oh! -Hijo estás viendo porno? -Si mamá -Uf, que alivio pensé que estabas escuchando Justin Bieber!""... noun punctuation noun punctuation interjection punctuation noun punctuation interjection punctuation punctuation noun verb verb adjective punctuation punctuation conjunction noun punctuation interjection punctuation pronoun noun verb conjunction verb verb noun punctuation punctuation punctuation",1
2030,La policía tendría que multar al viernes y al sábado por exceso de velocidad. determiner noun verb conjunction verb adposition determiner date conjunction adposition determiner date adposition noun adposition noun punctuation,1
2031,Típico: Cantar con los auriculares puestos creyendo que nadie te escucha. noun punctuation verb adposition determiner adjective noun verb conjunction pronoun pronoun verb punctuation,0
2032,Decir la verdad y que no te crean por reírte verb determiner noun conjunction conjunction adverb pronoun verb adposition verb pronoun,1
2033,Vengo del futuro para informarles que dentro de cinco días es jueves. verb adposition determiner noun adposition verb pronoun conjunction adposition number verb date punctuation,1
2034,"-Lo siento muchdo señoda, su madido a muedto… -¡No me joda! -No, ni mejoda ni empeoda, está muedto. punctuation pronoun verb verb noun punctuation determiner verb adposition noun punctuation punctuation punctuation adverb pronoun verb punctuation punctuation adverb punctuation conjunction noun conjunction noun punctuation verb noun punctuation",1
2035,Si la vida fuera vodka me la tomaría más en serio. conjunction determiner noun verb noun pronoun pronoun verb adverb adposition adjective punctuation,1
2036,- ¿Me haces un favor? - ¿Me tengo que levantar? -Sí -Entonces no punctuation punctuation pronoun verb determiner noun punctuation punctuation punctuation pronoun verb conjunction verb punctuation punctuation adverb punctuation adverb adverb,1
2037,"- ¿Jugamos a las escondidas? -Dale, pero si te encuentro te beso -Ok, cualquier cosa estoy detrás de la puerta punctuation punctuation verb adposition determiner verb punctuation punctuation verb pronoun punctuation conjunction conjunction pronoun verb pronoun noun punctuation noun punctuation determiner noun verb adposition determiner noun",0
2038,"Ese momento incómodo en el que se te cae el celular y tienes que levantárlo junto con la tapa, la batería y tu dignidad. determiner noun adjective adposition determiner pronoun pronoun pronoun verb determiner adjective conjunction verb conjunction verb pronoun adposition determiner noun punctuation determiner noun conjunction determiner noun punctuation",1
2039,"Detrás de cada un ""¿Que vas hacer hoy?"" hay un ""Quiero salir contigo."" adposition determiner determiner punctuation punctuation pronoun verb verb adverb punctuation punctuation verb determiner punctuation verb verb pronoun punctuation punctuation",1
2040,"Si tu mujer te trata como un perro, trátala como un árbol!  conjunction determiner noun pronoun verb conjunction determiner noun punctuation verb pronoun conjunction determiner noun punctuation",1
2041,RT @SoloDeMujer: Recuerdo ese: ¿Cómo te va? El cual le quice responder con un ¿Cómo esperas que me vaya si no estamos juntos? noun punctuation noun punctuation verb pronoun punctuation punctuation pronoun pronoun verb punctuation determiner pronoun pronoun verb verb adposition determiner punctuation pronoun verb conjunction pronoun verb conjunction adverb verb adjective punctuation,0
2042,Típico: Cantar canciones en ingles con palabras que ni existen noun punctuation verb noun adposition noun adposition noun pronoun adverb verb,1
2043,"—Hola, ¿como estas? 
—Bien, ¿y tú? 
—Bien también 
—¿Qué haces? 
—Nada, ¿y tú? 
—Nada. FIN” punctuation noun punctuation punctuation conjunction determiner punctuation punctuation noun punctuation punctuation conjunction pronoun punctuation punctuation noun adverb punctuation punctuation determiner noun punctuation punctuation noun punctuation punctuation conjunction pronoun punctuation punctuation noun punctuation noun punctuation",0
2044,Larga vida a los hombres que contestan rápido los mensajes. adjective noun adposition determiner noun pronoun verb adverb determiner noun punctuation,0
2045,Consumir chocolate retrasa el envejecimiento. Conclusión: SOY INMORTAL. verb noun verb determiner noun punctuation noun punctuation noun punctuation,1
2046,Típico : –Profe ¿Puedo ir al baño?. –Cuando vuelta tu compañero. noun punctuation punctuation noun punctuation verb verb adposition determiner noun punctuation punctuation punctuation noun noun determiner noun punctuation,0
2047,¿Qué le dijo el café al azúcar? Sin ti mi vida es amarga...  punctuation pronoun pronoun verb determiner noun adposition determiner noun punctuation adposition pronoun determiner noun verb adjective punctuation,1
2048,"Típico: Estas llorando, te abrazan y lloras aun más. noun punctuation pronoun verb punctuation pronoun verb conjunction verb adverb adverb punctuation",0
2049,"Loca , bipolar , histerica , ALTERADA , hermosa , simpatica , tierna , celosa , enojona , peleadora , MUJER PERFECTA. adjective punctuation adjective punctuation adjective punctuation noun punctuation adjective punctuation adjective punctuation adjective punctuation adjective punctuation noun punctuation adjective punctuation noun punctuation",0
2050,"Ver a tus amigos y pensar: “Cuando los conocí, parecían normales.” verb adposition determiner noun conjunction verb punctuation punctuation conjunction pronoun verb punctuation verb adjective punctuation punctuation",0
2051,RT @NewBirdVe: La mujer promedio camina 3 millas más por dia que el hombre promedio. ¿Será que ellos son más flojos? noun punctuation noun punctuation determiner noun noun verb number adverb adposition noun conjunction determiner noun noun punctuation punctuation verb conjunction pronoun verb adverb adjective punctuation,0
2052,Los celos son para las personas que no saben usar una escopeta. determiner noun verb adposition determiner noun pronoun adverb verb verb determiner noun punctuation,1
2053,"— ¿Quieres chocolate? — No gracias, no me gusta. — ¡Oh! ¡Misericordioso Dios! perdónalo, no sabe lo que dice esta pequeña criatura. punctuation punctuation verb noun punctuation punctuation noun noun punctuation adverb pronoun verb punctuation punctuation punctuation interjection punctuation punctuation noun punctuation verb pronoun punctuation adverb verb determiner pronoun verb determiner adjective noun punctuation",1
2054,"Mi cama huele a ti Lupita, 12 años, 1ero. de secundaria, orino su almohada de Monsters University. determiner noun verb adposition pronoun punctuation noun punctuation number noun punctuation number punctuation adposition adjective punctuation verb determiner noun adposition noun punctuation",1
2055,Quiero un maldito mensaje que me alegre la noche. Sólo uno. verb determiner adjective noun pronoun pronoun verb determiner noun punctuation adverb pronoun punctuation,0
2056,"Si te dijo ""sueltame"" y la soltaste, si te dijo ""tengo frío"" y no la abrazaste, si te dijo ""adiós"" y te fuiste, FRACASASTE como hombre. conjunction pronoun verb punctuation verb pronoun punctuation conjunction pronoun verb punctuation conjunction pronoun verb punctuation verb noun punctuation conjunction adverb pronoun verb punctuation conjunction pronoun verb punctuation interjection punctuation conjunction pronoun verb punctuation noun conjunction noun punctuation",0
2057,"-Juan, te noto algo diferente -Soy Pedro -Ah, eso era... punctuation noun punctuation pronoun verb pronoun adjective punctuation verb noun punctuation interjection punctuation pronoun verb punctuation",1
2058,Daría tu vida por mí. verb determiner noun adposition pronoun punctuation,0
2059,Tú Yo A 3MSC Yo te empujo Tú te caes Y mueres Piénsalo... pronoun noun number noun pronoun verb noun pronoun verb noun verb noun punctuation,0
2060,- ¿Dónde vas a pasar las vacaciones? -En Twitter. punctuation punctuation pronoun verb adposition verb determiner noun punctuation punctuation adposition noun punctuation,1
2061,"-Sr Lobo, cuando mi abuela se entere que me violó 5 veces, lo va a matar —Caperucita fue solo una vez! —¿Qué?¿Ya te vas pinche flojo? punctuation noun punctuation conjunction determiner noun pronoun verb pronoun pronoun verb number noun punctuation pronoun verb adposition verb punctuation noun verb adverb determiner noun punctuation punctuation punctuation pronoun punctuation punctuation adverb pronoun verb noun adjective punctuation",1
2062,"Cosas que hago mientras estudio: 1% estudiar, 29% mirar cuantas hojas de apuntes me quedan, 70% decirle a los demás que tengo que estudiar. noun pronoun verb conjunction noun punctuation number verb punctuation number verb determiner noun adposition noun pronoun verb punctuation number verb pronoun adposition determiner pronoun pronoun verb conjunction verb punctuation",1
2063,Típico: mirar el examen y decir y esto cuando han enseñado. noun punctuation verb determiner noun conjunction verb conjunction pronoun pronoun verb verb punctuation,0
2064,"Están 2 cocodrilos cuando pasa una mujer sin brazo y sin pierna y un cocodrilo dice: -Mira, esa es la mamacita que me estoy comiendo! verb number noun pronoun verb determiner noun adposition noun conjunction adposition noun conjunction determiner noun verb punctuation punctuation verb punctuation pronoun verb determiner noun pronoun pronoun verb verb punctuation",0
2065,"No estoy de acuerdo en que la gente diga ""La edad es sólo un número"". La edad es claramente una palabra. adverb verb adposition noun adposition conjunction determiner noun verb punctuation determiner noun verb adverb determiner noun punctuation punctuation determiner noun verb adverb determiner noun punctuation",1
2066,"Pareja termina de hacer el amor. Ella: -¿Tu eres anestesiólogo? -Si, ¿cómo supiste? -Porque no sentí ni mierda! by @JenniferGamba noun verb adposition verb determiner noun punctuation pronoun punctuation punctuation punctuation determiner verb noun punctuation punctuation conjunction punctuation punctuation pronoun verb punctuation punctuation conjunction adverb verb conjunction noun punctuation noun punctuation noun",1
2067,"Abres un paquete de chicles, y de repente todo el mundo es tu mejor amigo. verb determiner noun adposition noun punctuation conjunction adverb determiner determiner noun verb determiner adjective noun punctuation",0
2068,-Mi hijo esta yendo a clases de natación - ¿Y qué tal lo hace? -Nada mal. punctuation determiner noun pronoun verb adposition noun adposition noun punctuation punctuation conjunction pronoun pronoun pronoun verb punctuation punctuation pronoun adverb punctuation,1
2069,Típico: Estudiar en voz alta para crear una falsa sensación de aprendizaje. noun punctuation verb adposition noun adjective adposition verb determiner adjective noun adposition noun punctuation,1
2070, Te amo.  ¿A mí y a cuántas más?  Depende de las hijas que vayamos a tener. punctuation noun verb punctuation punctuation punctuation adposition pronoun conjunction adposition pronoun adverb punctuation punctuation noun adposition determiner noun pronoun verb adposition verb punctuation,0
2071,"Avísame cuando madures, estaré en los columpios esperando. verb pronoun conjunction verb punctuation verb adposition determiner noun verb punctuation",1
2072,"- ¿Cómo se dice perro en ingles?  -Dog -Muy bien, ¿y veterinario?  - ¡Dogtor!  punctuation punctuation pronoun pronoun verb noun adposition noun punctuation punctuation noun punctuation adverb adverb punctuation punctuation conjunction adjective punctuation punctuation punctuation noun punctuation",1
2073,"- ¿Yo mentir? ¿YO MAMÁ? ¿O TAL VEZ DEBERÍA DECIR RATONCITO PÉREZ? -Per... -PERDÓN POR MENTIR, REYES MAGOS -Es que hij... -PAPÁ NOEL punctuation punctuation pronoun verb punctuation punctuation noun punctuation punctuation conjunction noun punctuation punctuation noun punctuation punctuation noun punctuation noun punctuation verb conjunction noun punctuation punctuation noun",1
2074,2 palabras 11 letras 100 complicaciones 1 desgracia.   “Batería baja”. number noun number noun number noun number noun punctuation punctuation noun adjective punctuation punctuation,1
2075,Prefiero dormir que sentir amor. Por lo menos el sueño nunca te engaña. verb verb conjunction verb noun punctuation adverb determiner noun adverb pronoun verb punctuation,1
2076,¿Qué hace Batman en casa de Batichica? ¡Batirarsela!  punctuation pronoun verb noun adposition noun adposition noun punctuation punctuation noun punctuation,1
2077,—No juegues con mis sentimientos ¿Crees que soy de madera? —JAJAJA No te enojes Pinocho. punctuation noun verb adposition determiner noun punctuation verb conjunction verb adposition noun punctuation punctuation noun pronoun verb noun punctuation,1
2078,"¡CASA SOLA! ""Perspectiva: Fiesta loca con todos tus amigos"". ""Realidad: Ir al baño con la puerta abierta"". punctuation noun punctuation punctuation noun punctuation noun adjective adposition determiner determiner noun punctuation punctuation punctuation noun punctuation verb adposition determiner noun adposition determiner noun verb punctuation punctuation",1
2079,Un negrito a la registraduria: -Oiga Jeñol porque tengo 2 fotos en la cedula? -Señor esa es la huella digital! by @JuanDavidAhumaden determiner adjective adposition determiner noun punctuation punctuation verb noun conjunction verb number noun adposition determiner noun punctuation punctuation interjection pronoun verb determiner noun adjective punctuation noun punctuation noun,1
2080,"-Tenemos una relación seria. -¿Lleváis mucho tiempo? -Tres días, pero no nos reímos. punctuation verb determiner noun adjective punctuation punctuation punctuation verb determiner noun punctuation punctuation number punctuation conjunction adverb pronoun verb punctuation",1
2081,"Quiero ser la razón, por el cual agarres tu celular al amanecer, para ver si hay algún mensaje mío. verb verb determiner noun punctuation adposition determiner pronoun noun determiner adjective adposition determiner noun punctuation adposition verb conjunction verb determiner noun adjective punctuation",0
2082,"Y Jesús partió el pan y dijo: ¿15cm o 30cm? ¿De pan de ajo, blanco o Integral ? ¿Todas las verduras? ¿Tostado o caliente?. conjunction noun verb determiner noun conjunction verb punctuation punctuation number conjunction number punctuation punctuation adposition noun adposition noun punctuation adjective conjunction noun punctuation punctuation determiner determiner noun punctuation punctuation verb conjunction adjective punctuation punctuation",1
2083,Típico: Abuelas que antes de decirte tu nombre nombran a todos tus primos. noun punctuation noun conjunction adposition verb pronoun determiner noun verb adposition determiner determiner noun punctuation,1
2084,"—Profesor, no alcancé a apuntar, ¿puede repetir? —Sí, ¿en qué parte te perdiste? —Más o menos en el inicio del semestre. punctuation noun punctuation adverb verb adposition verb punctuation punctuation verb verb punctuation punctuation noun punctuation punctuation adposition pronoun verb pronoun verb punctuation punctuation noun conjunction adverb adposition determiner noun adposition determiner noun punctuation",1
2085,"Es considerado una ""traición"" que tu mejor amigo/a se junte con alguien que no te agrada. verb verb determiner punctuation noun punctuation conjunction determiner adjective noun punctuation adposition pronoun verb adposition pronoun pronoun adverb pronoun verb punctuation",0
