,text,category
2016,"En la amistad prefiero ""calidad"" antes que ""cantidad"". adposition determiner noun verb punctuation noun punctuation adverb conjunction punctuation noun punctuation punctuation",0
2017,Un queso parmesano se ralló porque la esposa que estaba ricotta termino de mozarella de un campesino... by @DrGoyo   determiner noun adjective pronoun verb conjunction determiner noun pronoun verb noun verb adposition noun adposition determiner noun punctuation noun punctuation noun,1
2018,RT @LaBallenaLlena: ¿Arreglarse y llegar tarde o salir como loca y llegar a tiempo?  noun punctuation noun punctuation punctuation verb pronoun conjunction verb noun conjunction verb conjunction adjective conjunction verb adposition noun punctuation,0
2019,¿BONITO? Bonito es despertar con un mensaje de buenos dias. punctuation adjective punctuation adjective verb verb adposition determiner noun adposition adjective noun punctuation,0
2020,Google Earth nos permite explorar el mundo entero y siempre terminamos buscando nuestra casa :| noun pronoun verb verb determiner noun adjective conjunction adverb verb verb determiner noun punctuation punctuation,1
2021,"-Papá, ¿qué se siente tener un hijo tan lindo? -No sé hijo, pregúntale a tu abuelo. punctuation noun punctuation punctuation pronoun pronoun verb verb determiner noun adverb adjective punctuation punctuation adverb verb noun punctuation verb pronoun adposition determiner noun punctuation",1
2022,RT @KlipXtreme: Se uno de nuestros primeros 500 seguidores y participa por docenas de accesorios tecnológicos ¿Qué esperas?  noun punctuation noun punctuation pronoun pronoun adposition determiner adjective number noun conjunction verb adposition noun adposition noun adjective punctuation determiner noun punctuation,0
2023,"Los teléfonos móviles serán inteligentes el día en que te digan ""Yo no mandaría ese mensaje si fuera tú"". determiner noun adjective verb adjective determiner noun adposition conjunction pronoun verb punctuation pronoun adverb verb determiner noun conjunction adverb pronoun punctuation punctuation",0
2024,Nada mejor que recordar viejos tiempos y reírse de las locuras que hacías con tus amigos. pronoun adverb conjunction verb adjective noun conjunction verb pronoun adposition determiner noun pronoun verb adposition determiner noun punctuation,0
2025,"-Decile vos -No, decile vos, es tu mamá -Pero a mi me va a decir que no, dale decile vos -Bueno, pero acompáñame. punctuation noun pronoun punctuation adverb punctuation noun pronoun punctuation verb determiner noun punctuation conjunction adposition determiner pronoun verb adposition verb conjunction adverb punctuation verb pronoun noun pronoun punctuation interjection punctuation conjunction verb pronoun punctuation",1
2026,RT @ElSaborDelCafe: ¿Sabías que…? La palabra ‘cappuccino’ proviene de la semejanza entre la bebida y elatuendo de los monjes capuchinos. noun punctuation noun punctuation punctuation verb conjunction punctuation punctuation determiner noun punctuation noun punctuation verb adposition determiner noun adposition determiner noun conjunction verb adposition determiner noun adjective punctuation,0
2027,Típico : Apagar la luz del pasillo y correr lo más rápido posible para que nadie te asesine. noun punctuation verb determiner noun adposition determiner noun conjunction verb determiner adverb adjective adjective adposition conjunction pronoun pronoun verb punctuation,1
2028,"¿Extrañarte? Jajajajaja ni que fueras... Bueno si, si te extraño :( punctuation verb pronoun punctuation noun conjunction verb punctuation interjection conjunction punctuation conjunction pronoun verb punctuation punctuation",0
2029,"-Mamá, mamá... ¿cual es la definición de paranoico? -Probablemente crees que no lo sé y me quieres pillar ¿verdad?   punctuation noun punctuation noun punctuation punctuation pronoun verb determiner noun adposition noun punctuation punctuation adverb verb conjunction adverb pronoun verb conjunction pronoun verb verb punctuation noun punctuation",1
2030,"A mi también me dijeron ""TE DEBO TU REGALO"" y hasta ahora lo estoy esperando ¬¬ adposition determiner adverb pronoun verb punctuation noun punctuation conjunction adposition adverb pronoun verb verb punctuation punctuation",0
2031,Nunca discutas con una mujer que escribe más rápido que tú. adverb verb adposition determiner noun pronoun verb adverb adjective conjunction pronoun punctuation,1
2032,"— ¿Te caíste? —No, el piso me quería contar un secreto punctuation punctuation pronoun verb punctuation punctuation noun punctuation determiner noun pronoun verb verb determiner noun",1
2033,"-Cuando el viudo Ruiz murió, dejó todo lo que tenía al orfanato -Oye, qué generoso -No. Lo único que tenía eran sus 12 hijos.  punctuation conjunction determiner noun noun verb punctuation verb determiner determiner pronoun verb adposition determiner noun punctuation verb punctuation pronoun adjective punctuation adverb punctuation determiner adjective pronoun verb verb determiner number noun punctuation",1
2034,¿Cuál es la diferencia entre el ACNÉ y un sacerdote? El acné no ataca a chicos de 8 años. by @hadacon  punctuation pronoun verb determiner noun adposition determiner noun conjunction determiner noun punctuation determiner noun adverb verb adposition noun adposition number noun punctuation noun punctuation noun,0
2035,"-Mi novio y yo tenemos una relación seria - ¿Llevan mucho tiempo de novios? -No, solo 3 días, pero no nos reímos. punctuation determiner noun conjunction pronoun verb determiner noun adjective punctuation punctuation verb determiner noun adposition noun punctuation punctuation adverb punctuation adverb number punctuation conjunction adverb pronoun verb punctuation",1
2036,No hay traición más grande que decir quién fue el que te dio el chicle. adverb verb noun adverb adjective conjunction verb pronoun verb determiner pronoun pronoun verb determiner noun punctuation,0
2037,"Una mujer tan fea, tan fea que le dicen la tortilla de arriba... Porque todos la manosean pero nadie se la come... by @riczamorano determiner noun adverb adjective punctuation adverb adjective pronoun pronoun verb determiner noun adposition adverb punctuation conjunction pronoun pronoun verb conjunction pronoun pronoun pronoun verb punctuation noun punctuation noun",1
2038,"Baby, baby, ohh! baby, oh! -Hijo estás viendo porno? -Si mamá -Uf, que alivio pensé que estabas escuchando Justin Bieber!""... noun punctuation noun punctuation interjection punctuation noun punctuation interjection punctuation punctuation noun verb verb adjective punctuation punctuation conjunction noun punctuation interjection punctuation pronoun noun verb conjunction verb verb noun punctuation punctuation punctuation",1
2039,La policía tendría que multar al viernes y al sábado por exceso de velocidad. determiner noun verb conjunction verb adposition determiner date conjunction adposition determiner date adposition noun adposition noun punctuation,1
2040,Típico: Cantar con los auriculares puestos creyendo que nadie te escucha. noun punctuation verb adposition determiner adjective noun verb conjunction pronoun pronoun verb punctuation,0
2041,Decir la verdad y que no te crean por reírte verb determiner noun conjunction conjunction adverb pronoun verb adposition verb pronoun,0
2042,Vengo del futuro para informarles que dentro de cinco días es jueves. verb adposition determiner noun adposition verb pronoun conjunction adposition number verb date punctuation,1
2043,"-Lo siento muchdo señoda, su madido a muedto… -¡No me joda! -No, ni mejoda ni empeoda, está muedto. punctuation pronoun verb verb noun punctuation determiner verb adposition noun punctuation punctuation punctuation adverb pronoun verb punctuation punctuation adverb punctuation conjunction noun conjunction noun punctuation verb noun punctuation",1
2044,Si la vida fuera vodka me la tomaría más en serio. conjunction determiner noun verb noun pronoun pronoun verb adverb adposition adjective punctuation,1
2045,- ¿Me haces un favor? - ¿Me tengo que levantar? -Sí -Entonces no punctuation punctuation pronoun verb determiner noun punctuation punctuation punctuation pronoun verb conjunction verb punctuation punctuation adverb punctuation adverb adverb,1
2046,"- ¿Jugamos a las escondidas? -Dale, pero si te encuentro te beso -Ok, cualquier cosa estoy detrás de la puerta punctuation punctuation verb adposition determiner verb punctuation punctuation verb pronoun punctuation conjunction conjunction pronoun verb pronoun noun punctuation noun punctuation determiner noun verb adposition determiner noun",0
2047,"Ese momento incómodo en el que se te cae el celular y tienes que levantárlo junto con la tapa, la batería y tu dignidad. determiner noun adjective adposition determiner pronoun pronoun pronoun verb determiner adjective conjunction verb conjunction verb pronoun adposition determiner noun punctuation determiner noun conjunction determiner noun punctuation",0
2048,"Detrás de cada un ""¿Que vas hacer hoy?"" hay un ""Quiero salir contigo."" adposition determiner determiner punctuation punctuation pronoun verb verb adverb punctuation punctuation verb determiner punctuation verb verb pronoun punctuation punctuation",0
2049,RT @SoloDeMujer: Recuerdo ese: ¿Cómo te va? El cual le quice responder con un ¿Cómo esperas que me vaya si no estamos juntos? noun punctuation noun punctuation verb pronoun punctuation punctuation pronoun pronoun verb punctuation determiner pronoun pronoun verb verb adposition determiner punctuation pronoun verb conjunction pronoun verb conjunction adverb verb adjective punctuation,0
2050,Típico: Cantar canciones en ingles con palabras que ni existen noun punctuation verb noun adposition noun adposition noun pronoun adverb verb,1
2051,"—Hola, ¿como estas? 
—Bien, ¿y tú? 
—Bien también 
—¿Qué haces? 
—Nada, ¿y tú? 
—Nada. FIN” punctuation noun punctuation punctuation conjunction determiner punctuation punctuation noun punctuation punctuation conjunction pronoun punctuation punctuation noun adverb punctuation punctuation determiner noun punctuation punctuation noun punctuation punctuation conjunction pronoun punctuation punctuation noun punctuation noun punctuation",0
2052,Consumir chocolate retrasa el envejecimiento. Conclusión: SOY INMORTAL. verb noun verb determiner noun punctuation noun punctuation noun punctuation,1
2053,Me gusta romper las reglas... También las escuadras y transportadores... pronoun verb verb determiner noun punctuation adverb determiner noun conjunction noun punctuation,1
2054,"A whatsapp le falta la opción ""abandonar grupo sin que se note"". adposition noun pronoun verb determiner noun punctuation verb noun adposition conjunction pronoun verb punctuation punctuation",1
2055,Típico : –Profe ¿Puedo ir al baño?. –Cuando vuelta tu compañero. noun punctuation punctuation noun punctuation verb verb adposition determiner noun punctuation punctuation punctuation noun noun determiner noun punctuation,0
2056,"Típico: Estas llorando, te abrazan y lloras aun más. noun punctuation pronoun verb punctuation pronoun verb conjunction verb adverb adverb punctuation",0
2057,"Loca , bipolar , histerica , ALTERADA , hermosa , simpatica , tierna , celosa , enojona , peleadora , MUJER PERFECTA. adjective punctuation adjective punctuation adjective punctuation noun punctuation adjective punctuation adjective punctuation adjective punctuation adjective punctuation noun punctuation adjective punctuation noun punctuation",0
2058,"Ver a tus amigos y pensar: “Cuando los conocí, parecían normales.” verb adposition determiner noun conjunction verb punctuation punctuation conjunction pronoun verb punctuation verb adjective punctuation punctuation",0
2059,RT @NewBirdVe: La mujer promedio camina 3 millas más por dia que el hombre promedio. ¿Será que ellos son más flojos? noun punctuation noun punctuation determiner noun noun verb number adverb adposition noun conjunction determiner noun noun punctuation punctuation verb conjunction pronoun verb adverb adjective punctuation,0
2060,Los celos son para las personas que no saben usar una escopeta. determiner noun verb adposition determiner noun pronoun adverb verb verb determiner noun punctuation,1
2061,"— ¿Quieres chocolate? — No gracias, no me gusta. — ¡Oh! ¡Misericordioso Dios! perdónalo, no sabe lo que dice esta pequeña criatura. punctuation punctuation verb noun punctuation punctuation noun noun punctuation adverb pronoun verb punctuation punctuation punctuation interjection punctuation punctuation noun punctuation verb pronoun punctuation adverb verb determiner pronoun verb determiner adjective noun punctuation",1
2062,"Mi cama huele a ti Lupita, 12 años, 1ero. de secundaria, orino su almohada de Monsters University. determiner noun verb adposition pronoun punctuation noun punctuation number noun punctuation number punctuation adposition adjective punctuation verb determiner noun adposition noun punctuation",1
2063,Quiero un maldito mensaje que me alegre la noche. Sólo uno. verb determiner adjective noun pronoun pronoun verb determiner noun punctuation adverb pronoun punctuation,0
2064,"Si te dijo ""sueltame"" y la soltaste, si te dijo ""tengo frío"" y no la abrazaste, si te dijo ""adiós"" y te fuiste, FRACASASTE como hombre. conjunction pronoun verb punctuation verb pronoun punctuation conjunction pronoun verb punctuation conjunction pronoun verb punctuation verb noun punctuation conjunction adverb pronoun verb punctuation conjunction pronoun verb punctuation interjection punctuation conjunction pronoun verb punctuation noun conjunction noun punctuation",0
2065,Daría tu vida por mí. verb determiner noun adposition pronoun punctuation,0
2066,"En casa, la última palabra la tengo yo... ¡Sí mi amor! @neneaguero   adposition noun punctuation determiner adjective noun pronoun verb pronoun punctuation punctuation adverb determiner noun punctuation punctuation noun",1
2067,Tú Yo A 3MSC Yo te empujo Tú te caes Y mueres Piénsalo... pronoun noun number noun pronoun verb noun pronoun verb noun verb noun punctuation,0
2068,- ¿Dónde vas a pasar las vacaciones? -En Twitter. punctuation punctuation pronoun verb adposition verb determiner noun punctuation punctuation adposition noun punctuation,1
2069,"-Sr Lobo, cuando mi abuela se entere que me violó 5 veces, lo va a matar —Caperucita fue solo una vez! —¿Qué?¿Ya te vas pinche flojo? punctuation noun punctuation conjunction determiner noun pronoun verb pronoun pronoun verb number noun punctuation pronoun verb adposition verb punctuation noun verb adverb determiner noun punctuation punctuation punctuation pronoun punctuation punctuation adverb pronoun verb noun adjective punctuation",1
2070,Típico: mirar el examen y decir y esto cuando han enseñado. noun punctuation verb determiner noun conjunction verb conjunction pronoun pronoun verb verb punctuation,0
2071,"Están 2 cocodrilos cuando pasa una mujer sin brazo y sin pierna y un cocodrilo dice: -Mira, esa es la mamacita que me estoy comiendo! verb number noun pronoun verb determiner noun adposition noun conjunction adposition noun conjunction determiner noun verb punctuation punctuation verb punctuation pronoun verb determiner noun pronoun pronoun verb verb punctuation",0
2072,"No estoy de acuerdo en que la gente diga ""La edad es sólo un número"". La edad es claramente una palabra. adverb verb adposition noun adposition conjunction determiner noun verb punctuation determiner noun verb adverb determiner noun punctuation punctuation determiner noun verb adverb determiner noun punctuation",1
2073,"Pareja termina de hacer el amor. Ella: -¿Tu eres anestesiólogo? -Si, ¿cómo supiste? -Porque no sentí ni mierda! by @JenniferGamba noun verb adposition verb determiner noun punctuation pronoun punctuation punctuation punctuation determiner verb noun punctuation punctuation conjunction punctuation punctuation pronoun verb punctuation punctuation conjunction adverb verb conjunction noun punctuation noun punctuation noun",1
2074,"Abres un paquete de chicles, y de repente todo el mundo es tu mejor amigo. verb determiner noun adposition noun punctuation conjunction adverb determiner determiner noun verb determiner adjective noun punctuation",0
2075,Típico: Estudiar en voz alta para crear una falsa sensación de aprendizaje. noun punctuation verb adposition noun adjective adposition verb determiner adjective noun adposition noun punctuation,1
2076, Te amo.  ¿A mí y a cuántas más?  Depende de las hijas que vayamos a tener. punctuation noun verb punctuation punctuation punctuation adposition pronoun conjunction adposition pronoun adverb punctuation punctuation noun adposition determiner noun pronoun verb adposition verb punctuation,0
2077,¿Qué es un pollito encima de un tenedor? Un pollito encubierto. punctuation pronoun verb determiner noun adposition determiner noun punctuation determiner noun verb punctuation,1
2078,"- ¿Cómo se dice perro en ingles?  -Dog -Muy bien, ¿y veterinario?  - ¡Dogtor!  punctuation punctuation pronoun pronoun verb noun adposition noun punctuation punctuation noun punctuation adverb adverb punctuation punctuation conjunction adjective punctuation punctuation punctuation noun punctuation",1
2079,"- ¿Yo mentir? ¿YO MAMÁ? ¿O TAL VEZ DEBERÍA DECIR RATONCITO PÉREZ? -Per... -PERDÓN POR MENTIR, REYES MAGOS -Es que hij... -PAPÁ NOEL punctuation punctuation pronoun verb punctuation punctuation noun punctuation punctuation conjunction noun punctuation punctuation noun punctuation punctuation noun punctuation noun punctuation verb conjunction noun punctuation punctuation noun",1
2080,Prefiero dormir que sentir amor. Por lo menos el sueño nunca te engaña. verb verb conjunction verb noun punctuation adverb determiner noun adverb pronoun verb punctuation,1
2081,¿Qué hace Batman en casa de Batichica? ¡Batirarsela!  punctuation pronoun verb noun adposition noun adposition noun punctuation punctuation noun punctuation,1
2082,Un negrito a la registraduria: -Oiga Jeñol porque tengo 2 fotos en la cedula? -Señor esa es la huella digital! by @JuanDavidAhumaden determiner adjective adposition determiner noun punctuation punctuation verb noun conjunction verb number noun adposition determiner noun punctuation punctuation interjection pronoun verb determiner noun adjective punctuation noun punctuation noun,1
2083,"Y Jesús partió el pan y dijo: ¿15cm o 30cm? ¿De pan de ajo, blanco o Integral ? ¿Todas las verduras? ¿Tostado o caliente?. conjunction noun verb determiner noun conjunction verb punctuation punctuation number conjunction number punctuation punctuation adposition noun adposition noun punctuation adjective conjunction noun punctuation punctuation determiner determiner noun punctuation punctuation verb conjunction adjective punctuation punctuation",1
2084,"Te rascas un ojo. 
Recuerdas que ibas maquillada. 
Eres un mapache. pronoun verb determiner noun punctuation verb conjunction verb verb punctuation verb determiner noun punctuation",0
2085,"- ¿Te estás bañando? -No, me estoy regando a ver si crezco. punctuation punctuation pronoun verb verb punctuation punctuation adverb punctuation pronoun verb verb adposition verb conjunction verb punctuation",1
2086,"—Profesor, no alcancé a apuntar, ¿puede repetir? —Sí, ¿en qué parte te perdiste? —Más o menos en el inicio del semestre. punctuation noun punctuation adverb verb adposition verb punctuation punctuation verb verb punctuation punctuation noun punctuation punctuation adposition pronoun verb pronoun verb punctuation punctuation noun conjunction adverb adposition determiner noun adposition determiner noun punctuation",1
2087,"Es considerado una ""traición"" que tu mejor amigo/a se junte con alguien que no te agrada. verb verb determiner punctuation noun punctuation conjunction determiner adjective noun punctuation adposition pronoun verb adposition pronoun pronoun adverb pronoun verb punctuation",0
2088,"RT @MichelPesquera: Buenos días a todos, los saludo desde Vancouver y ya voy de salida a Seattle. El clima ha estado espectacular. Al rato … noun punctuation noun punctuation adjective noun adposition pronoun punctuation determiner noun adposition noun conjunction adverb verb adposition noun adposition noun punctuation determiner noun verb verb adjective punctuation adposition determiner noun punctuation",0
2089,"Ciclo de la vida: Hombres detrás de las mujeres, mujeres detrás de Ricky Martin y Ricky detrás de los hombres! by @_3duar2_  noun adposition determiner noun punctuation noun adposition determiner noun punctuation noun adposition noun conjunction noun adposition determiner noun punctuation noun punctuation number punctuation",1
2090,"Y entonces Satanás dijo ""Hay que combinar las matemáticas y el abecedario"" conjunction adverb noun verb punctuation verb conjunction verb determiner noun conjunction determiner noun punctuation",1
2091,"No escribas mucho, a quien te responde poco. adverb verb adverb punctuation adposition pronoun pronoun verb adverb punctuation",0
2092,¿Los INFANTES disfrutan la INFANCIA tanto como los ADULTOS disfrutan el ADULTERIO? punctuation determiner noun verb determiner noun adverb conjunction determiner noun verb determiner noun punctuation,0
2093,"ATENCIÓN! Quieres ganar 100 seguidores? Sí? 

Estén pendientes ala dinámica de  que esta organizando @JohannStevenn ANIMATE! interjection punctuation verb verb number noun punctuation adverb punctuation verb adjective noun adjective adposition conjunction pronoun verb punctuation noun punctuation",0
2094,—Perdí 800 calorías en 2 segundos —¡WoW! ¿Cómo lo hiciste? — Se me cayó mi hamburguesa :( punctuation noun number noun adposition number noun punctuation punctuation noun punctuation punctuation pronoun pronoun verb punctuation punctuation noun pronoun verb determiner noun punctuation punctuation,1
2095,Dos tipos conversaban: -Mi mujer maneja como rayo -¿Muy aprisa? -No. Siempre pega en los árboles...  number noun verb punctuation punctuation determiner noun verb conjunction noun punctuation punctuation adverb adverb punctuation punctuation adverb punctuation adverb verb adposition determiner noun punctuation,1
2096,— BOBA HIJUEPUTA — ¿CÓMO ME DIJISTE? — Fue el autocorrector... — Pero tú tienes un Nokia 1100 — Fue la linternita. punctuation noun punctuation punctuation noun punctuation punctuation noun determiner noun punctuation punctuation noun pronoun verb determiner noun number punctuation noun determiner noun punctuation,1
2097,"Intenta pronunciar mentalmente la R sin mover la lengua, Jaja Pudiste? verb verb adverb determiner noun adposition verb determiner noun punctuation noun punctuation",1
2098,"—Nada es imposible.
—A ver rascate la espalda con la rodilla, positivo de mierda. punctuation noun verb adjective punctuation punctuation noun verb verb pronoun determiner noun adposition determiner noun punctuation adjective adposition noun punctuation",1
2099,Hoy me levanté con ganas de volverme a acostar. adverb pronoun verb adposition noun adposition verb pronoun adposition verb punctuation,0
2100,Típico: Ver a tus amigos y pensar: “Cuando los conocí parecían normales” noun punctuation verb adposition determiner noun conjunction verb punctuation punctuation conjunction pronoun verb verb adjective punctuation,1
2101,"-Vengo a buscar empleo - ¿Usted habla inglés? -Si señor - ¿Nivel? -Level JAJAJA ¿no me va a contratar, no? - ¡NO! - :( punctuation verb adposition verb noun punctuation punctuation pronoun verb noun punctuation punctuation conjunction noun punctuation punctuation noun punctuation punctuation noun punctuation adverb pronoun verb adposition verb punctuation adverb punctuation punctuation punctuation adverb punctuation punctuation punctuation punctuation",1
2102,"-¿Cómo te fue en el colegio Jaimito? -Hice una redacción que conmovió al profesor -Ah sí? -Sí, me dijo que daba pena. by @benitezcarlos2 punctuation punctuation pronoun pronoun verb adposition determiner noun noun punctuation punctuation verb determiner noun pronoun verb adposition determiner noun punctuation interjection adverb punctuation punctuation adverb punctuation pronoun verb conjunction verb noun punctuation noun punctuation number",1
2103,"Censo: –Nombre? –Adán –Su Esposa? – Eva – JA JA, ¿la serpiente también vive aquí? –Sí, un momento. SUEGRAAA!!! noun punctuation punctuation noun punctuation punctuation noun punctuation noun punctuation punctuation noun punctuation noun punctuation punctuation determiner noun adverb verb adverb punctuation punctuation noun punctuation determiner noun punctuation noun punctuation punctuation punctuation",1
2104,"—Vas a ser papá, ¡Estoy EMBARAZADA!! —¡Que felicidad amor! —Caíste Feliz Día De Los Inocentes! —¿No estas embarazada? —Sí, pero no es tuyo. punctuation noun adposition verb noun punctuation punctuation verb noun punctuation punctuation punctuation punctuation conjunction noun noun punctuation punctuation noun punctuation punctuation punctuation adverb determiner noun punctuation punctuation noun punctuation conjunction adverb verb adjective punctuation",1
2105,"RT @Ejercitandote: No trabajes con intensidad un músculo que no ha tenido 48 horas de descanso. Lo desgastas, pierdes masa muscular. noun punctuation noun punctuation adverb verb adposition noun determiner noun pronoun adverb verb verb number adposition noun punctuation pronoun verb punctuation verb noun adjective punctuation",0
